app_id,userName,score,at,content
com.HoYoverse.Nap,Mia Angelina,5,2024-07-06 16:17:32,Gameplay seru ceritanya masih simple untuk saat ini
com.HoYoverse.Nap,Bagas Noval Romadon 116,1,2024-07-06 16:07:19,Jelek game kikir
com.HoYoverse.Nap,ilyas panji,5,2024-07-06 15:56:37,"Nice story, nice grapich, nice music 👌🏻"
com.HoYoverse.Nap,Ghea Dhitya,2,2024-07-06 15:49:33,"Stack di kompilasi shader 89,01%.. Apa karena device saya yg kentang.. tapi main ghensin, star rail, whutering wife aman2 aja.."
com.HoYoverse.Nap,Sky Choesni,1,2024-07-06 15:48:57,"Animasinya sangat bagus, tapi untuk main lama trlalu membosankan mulai dari mode tv - bolak-balik studio - kebanyakan percakapan - aksinya terlalu gampang bisa sambil tutup mata dan yang paling parah mode tvnya terlalu mengganggu dan meresahkan."
com.HoYoverse.Nap,Zia Yumna,1,2024-07-06 15:42:16,"Berulang ulang Stack di kompilasi shader 89,01%.. yg device nya khentang jgn coba2.. sayangilah kuota anda.."
com.HoYoverse.Nap,Taufan Kurniawan,3,2024-07-06 15:34:57,"Sering force close di Snapdragon 870 setting rata kiri, HP Poco F3"
com.HoYoverse.Nap,37. Teguh Adhisatya,5,2024-07-06 15:28:36,Perbanyak bansos nya
com.HoYoverse.Nap,RedSasori ID,5,2024-07-06 15:13:29,Ini kenapa ya kok sering keluar2 sendiri
com.HoYoverse.Nap,Dudu,1,2024-07-06 15:08:52,Game Rusak
com.HoYoverse.Nap,Roby Apriansyah YSF,5,2024-07-06 15:08:00,Mntp aku
com.HoYoverse.Nap,Rafli Andrian,5,2024-07-06 15:00:02,"Keren bangett.. Style story mirip kaya baca komik itu nuansa baru sih😄 Animasi bertarungnya keren, gaya translasi ke bahasa indonesianya juga unik.. Rekomen banget👍"
com.HoYoverse.Nap,Kensen S Muzakir,1,2024-07-06 14:53:35,"Mentok kompilasi shader 89,01℅ abis itu ga maju² lagi"
com.HoYoverse.Nap,Diaz Pujiyandi,5,2024-07-06 14:53:04,Yang ngasih bintang 🌟 1. Woi sadar diri hp lu kentang. Malah nyalain dev
com.HoYoverse.Nap,あくまKURO,5,2024-07-06 14:16:25,"Yah cukup menyenangkan dan seru untuk dimainkan, apalagi saya lagi sangat bosan ngescroll sosmed."
com.HoYoverse.Nap,1 banding 0,5,2024-07-06 14:11:56,Ini emng sizenya gede sih tapi kalo di maenin malahan lebih ringan dari tetangga .. Gameplay mekaniknya mantep sih
com.HoYoverse.Nap,Alessandro Wijaya,1,2024-07-06 13:43:06,"Mengecewakan, se akan akan bukan game khas hoyoberse, fitur TV seharusnya tidak diletakkan di setiap stage story, kami ingin menikmati pertarungan hack n slash yang asik, bukan mencet"" TV ga jelas"
com.HoYoverse.Nap,Joel Michael,5,2024-07-06 13:26:30,game ini yang mampu mampj aja ya guys yang main haha
com.HoYoverse.Nap,Fariz Al,3,2024-07-06 13:21:53,Blm nyoba
com.HoYoverse.Nap,Wiliam Izumi,5,2024-07-06 13:18:59,"Gk tahu mau komentar apa ,inti nya seru dan Bagus Banget 👍🏻👍🏻👍🏻👍🏻👍🏻"
com.HoYoverse.Nap,LULUSAN - COVID-19,1,2024-07-06 13:11:34,Berat sdgn 865
com.HoYoverse.Nap,Azmi Fitra,1,2024-07-06 13:08:06,"game ngantuk boring, tolong ilangin konsep tv ga jelas malah bikin boring."
com.HoYoverse.Nap,Yinlin,5,2024-07-06 13:04:44,Game baik
com.HoYoverse.Nap,Andi Bayu,1,2024-07-06 12:52:03,"Tolong segera diperbaiki, dimensity 8100 sering sekali force close membuat tidak nyaman dalam bermain."
com.HoYoverse.Nap,kiki mardianz,1,2024-07-06 12:36:50,"Udh pling bener main honkai aj Ni game di hp gw yg spekny tinggi aj bisa force close pdhl ga panas lho, Bug nya gila banget"
com.HoYoverse.Nap,BARBAR GAMING,1,2024-07-06 12:26:44,Tolong perbaiki bug dalam game yg bikin sebagian tampilan menjadi gelap 😓
com.HoYoverse.Nap,Bagas Ghifari,4,2024-07-06 12:07:36,Kurangi bug nya yah
com.HoYoverse.Nap,Mas Don,4,2024-07-06 12:06:14,"Kadang force close di kedua HP saya, padahal saya pake poco f3 & poco f5"
com.HoYoverse.Nap,Calvin Illa,1,2024-07-06 11:59:55,repetitif seperti gem mihoyo lainnya
com.HoYoverse.Nap,Hilmi Azizi,5,2024-07-06 11:43:06,gamenya bagus bangeeet
com.HoYoverse.Nap,French Captain,2,2024-07-06 11:23:20,"Game kebanyakan Loading. Masuk rumah loading, masuk toko loading, pindah jalan loading, masuk komputer loading, bener2 Loading Simulator. Asli kalo ga kebanyakan loading jadi bagus banget nih game."
com.HoYoverse.Nap,AxonAccel Go,5,2024-07-06 11:21:11,BAGUS!!! •Animasi karakter yang cukup halus. (Patah-patah karena device kureng). •Gameplay yang menarik dan cukup seru. •Design karakter-karakternya juga keren-keren. (Preferensi tiap orang bisa berbeda-beda) •Disaat berbicara dengan NPC jika arahnya tidak sesuai terkesan sedikit aneh. •Masih terdapat beberapa bug visual kecil. (Saya belum menemukan bug yang sampai mengganggu keseluruhan gameplay game ini.)
com.HoYoverse.Nap,Just IFaa (NFL),5,2024-07-06 11:19:10,Terimakasih telah membuat Redmi Note 10 Pro support game ini
com.HoYoverse.Nap,Burhan Abdillah,1,2024-07-06 11:11:04,"Boring banget game nya, banyak fitur yang bikin ini game males buat dimainin"
com.HoYoverse.Nap,Abhi Mchael,5,2024-07-06 11:05:58,Ga kikir
com.HoYoverse.Nap,Ferdianアズレ,1,2024-07-06 10:56:32,Kikir detected
com.HoYoverse.Nap,muhamad febrian,1,2024-07-06 10:47:39,"Force close ga jelas, main game lain ga pernah sama sekali force close mohon di perbaiki 🙏"
com.HoYoverse.Nap,Aldog Yaa,1,2024-07-06 10:45:40,Terlalu berat chipset 860 harus nya main di setingan low udah ringan tapi ini ga ngaruh dan main beberapa menit udah lag parah mana dah pake cooler ga ngaruh juga
com.HoYoverse.Nap,Ikky Koi,5,2024-07-06 10:38:33,"[tapi grafik fullmax dihp gua masi buriqk tapi mungkin karna settingan cuma sampe hd doang/resolusi hp gua yg 4k?] Ini game mihoyo terberat dari spek yg diminta jadi wajar klo ada yg force close, black screen/stuck load. Klo low spek sadar diri, dari jaman genshin v1.0 ngeluh berat tapi ga mau ganti device, ya ga usah maen, maen roblok gih biar makin goooob🤣"
com.HoYoverse.Nap,Budi Syahputra,1,2024-07-06 10:29:33,I have pitch black graphic. Development teams until now don't have an action to take down the bug. The gameplay absolutely amazing but the bug make me feel off about playing the game. So today I want uninstall it. Gameplay 4 / 5 Story 2 / 5 Music 5 / 5
com.HoYoverse.Nap,Ido muhamad,2,2024-07-06 10:15:19,"I don't know why i don't feel so good playing this game (motion sickness, nusea)"
com.HoYoverse.Nap,Rifqi Zanuar Aswar,1,2024-07-06 09:35:31,Scam bansos lol
com.HoYoverse.Nap,Cellias,5,2024-07-06 09:08:37,"Bagi yang ngeluh game nya gk bisa di buka, game nya ngeleg, ya berati HP lu gk support blok, kalau gk support jangan di paksain tu HP lolot"
com.HoYoverse.Nap,Tabah Aldy Febrian,1,2024-07-06 09:07:05,"kikir scam, 100 pull awal perilisan ternyata syarat dan ketentuannya sama aja kaya sebelumnya yang di buat. KIKIR ZONE"
com.HoYoverse.Nap,Radit A Dawn (Biju 8),1,2024-07-06 08:48:52,"Pas konfigurasi masuk game masa aplikasi multitask seperti discord dll langsung keluar, tolong optimalisasi lagi"
com.HoYoverse.Nap,Syaen.,3,2024-07-06 08:43:11,"gamenya bagus cuman rendernya bikin cpu hp langsung full jadi ngeframe parah, mungkin gamenya belum terlalu optimal padahl device sudah ok lah, saran mungkin untuk android rendringnya jangan disamakan dengan pc supaya kinerja hp gak terlalu brutal ajasih."
com.HoYoverse.Nap,Ilmi,5,2024-07-06 08:29:54,"Gamenya keren banget ini kualitasnya behh mantap bener, gameplaynya satisfying, nggak kaku, f2p friendly. sejauh ini menurutku game hoyoverse terbaik ( mungkin )"
com.HoYoverse.Nap,AD1TY4,5,2024-07-06 08:08:06,Bagus dari segi gameplay dan story tapi tolong untuk dimaksimalkan lagi untuk platform android performanya
com.HoYoverse.Nap,Dewi Anggraeni,5,2024-07-06 08:02:50,"Sejauh ini bermain lancar lancar aja, karena masih baru masih banyak yang belum dipahami. Dari segi cerita juga lumayan menarik"
com.HoYoverse.Nap,rama Wanted,3,2024-07-06 07:58:29,Harusnya strorynya langsung battle aja. Gk perlu yg layar tv banyak. Karna aku agak malas harus explor apalagi tap2 layar sambil mikir. Pengennya yg auto greding gampang. Seperti honkai impack. Itu aja sih keluanku. Kebanyakan makan waktu.
com.HoYoverse.Nap,Ptilopsis 17,1,2024-07-06 07:49:05,disappointing co-op gameplay
com.HoYoverse.Nap,Levi Sherwood (Hendra),1,2024-07-06 07:47:05,belum apa apa udah 17GB
com.HoYoverse.Nap,Ashia Fukarii,3,2024-07-06 07:41:38,The game is good but there is a bug. The game always crashing when open gacha menu or other menu.
com.HoYoverse.Nap,miftakhul umam,5,2024-07-06 07:20:45,Semoga awet dengan segala macam kritik dari Player lain...
com.HoYoverse.Nap,Mobil 123,1,2024-07-06 07:19:32,saat bermain lancar aj tapi kenapa latar tempatnya hitam...
com.HoYoverse.Nap,ditzzmell,5,2024-07-06 07:11:03,"ga lag ternyata haha, grafik cukup bagus dan ya pokoknya bagus deh game ini buat ngisi waktu luang akuu ><"
com.HoYoverse.Nap,Er _,5,2024-07-06 06:54:58,Press f
com.HoYoverse.Nap,Sleepie,5,2024-07-06 06:50:49,👍🏻
com.HoYoverse.Nap,Rafi Aditya Nugraha,5,2024-07-06 06:35:47,Ada bug force close mohon diperbaiki
com.HoYoverse.Nap,Chacan Surachan,5,2024-07-06 06:33:39,Satisfying
com.HoYoverse.Nap,Hari Indra Firdaus,5,2024-07-06 06:28:40,Game terbaik di dunia
com.HoYoverse.Nap,Herlambang Suroso,4,2024-07-06 06:24:55,"Fine fine aja, mines ini apa watashi aj yg ngerasain kalo ni game makan baterainya banyak y😁"
com.HoYoverse.Nap,RianBS,5,2024-07-06 05:28:17,"dari semua game hoyoverse, zzz yang paling membuat saya terkesan dengan mekanik gameplay, tema game, hingga musik. saya sangat merasa immersive dan sangat terkesan ketika ada adegan cutscene yng menurut saya sangat keren, yang membuat saya betah ketika memainkan sepanjang game ini"
com.HoYoverse.Nap,Rill tung!!,5,2024-07-06 05:17:47,Joss gandoss tenan👍👍🔥🔥
com.HoYoverse.Nap,Master Editz,5,2024-07-06 05:09:55,Perfect 👌
com.HoYoverse.Nap,Angga Suda Pamungkas,5,2024-07-06 04:40:37,bagus
com.HoYoverse.Nap,Arsa Anakin,5,2024-07-06 04:28:16,"satu satu nya game hoyo yg ga bisa gua maenin,spek hp udh terlalu old wkwkwk,pdhl udh sangat ditunggu perilisan ZZZ ini,utk yg hp nya udh ga relevan juga nt guys,semoga dpt rezeki lebih utk upgrade hp"
com.HoYoverse.Nap,Angga R,5,2024-07-06 03:47:56,Uwoooghh ellen
com.HoYoverse.Nap,Wahyu Agung Ramadhan,1,2024-07-06 03:29:16,"Gacha seret, pity ampas, konten minim"
com.HoYoverse.Nap,Ahmad Irfandi,1,2024-07-06 03:26:08,"Skipp all game hoyoverse ,bansos is SCAM"
com.HoYoverse.Nap,Habibie Sanjay,5,2024-07-06 03:17:09,"lancar game nya, story mantap, desain overall suka, combat lumayan lah g yg gimana gichuuu"
com.HoYoverse.Nap,NoName 69,1,2024-07-06 02:58:35,"Scam 180 gacha ternyata harus selesai quest dll, sebelum battle maen puzzle bikin ngantuk"
com.HoYoverse.Nap,Hasma Wati,5,2024-07-06 02:56:36,Semoga game baik tidak kikir
com.HoYoverse.Nap,bagus wibisono,5,2024-07-06 02:44:50,Nice game
com.HoYoverse.Nap,Aldi Aldi,5,2024-07-06 02:36:44,Sangat bagus
com.HoYoverse.Nap,Puji A,4,2024-07-06 01:42:35,"laporan buat game ini ,untuk gameplay aman aja pas battle juga smooth,cutscene,dll tapi masalahnya setiap buka tab event berasa berat bgt trus hp jadi stuck solusinya relog ulang biar kerefresh ,permasalahan ini gk cuma sekali setiap buka yab event selalu lag dan patah patah,jdi tolong difix secepatnya ,kalo udah difix bintang 5 dehh🙏"
com.HoYoverse.Nap,Rio Aditya Putra,5,2024-07-06 01:33:09,"Tidak ada kendala, game bagus. Semua orang yang ngasih bintang satu HPnya KENTANG!! 🤣🤣"
com.HoYoverse.Nap,Vaeris Wahyudi,3,2024-07-06 01:29:01,"Maaf udah main dapet 1 misi kok tetep hitam visualnya,graphic udah d turunkan sampai low? Mohon untuk developer lebih di tingkatkan lagi untuk visual pencahayaan di graphic medium ke low"
com.HoYoverse.Nap,irvankov,1,2024-07-06 01:12:20,Udah re roll 1000x masih ampas :'(
com.HoYoverse.Nap,Neta CharaYomeni,5,2024-07-06 01:12:04,Bagus gamenya ☺️ lebih santai juga sihhh 😃
com.HoYoverse.Nap,Khoirul Sama,5,2024-07-06 01:11:46,"Menurutku, game nya asik, dan masih ada beberapa bug, tapi masih ok mengingat masih game baru, dan buat yang komplain, lihat spek dlu ok? Game nya emang berat jadi jangan di paksa🗿"
com.HoYoverse.Nap,Asta Demon,1,2024-07-06 01:06:13,"Seluruh loading lama,masuk rumah loading,parkiran loading apa apa loading udh lama lumayan bosen"
com.HoYoverse.Nap,EVOS Firman,1,2024-07-06 01:02:10,Ga ngotak data awal nya
com.HoYoverse.Nap,Zulkarnain Tea,5,2024-07-06 01:01:31,nice gameee
com.HoYoverse.Nap,Suizen Ramdhani,4,2024-07-06 00:48:57,Tolong segera diperbaiki bug bug yg ada
com.HoYoverse.Nap,Ayane lia,5,2024-07-06 00:48:48,"Very good game, style retro nya cakep, battle vfx bagus, sfx nya asik, interaksi antara player dan npc sangat menarik, puzzle nya cukup sulit. It's a good game tbh❤"
com.HoYoverse.Nap,Refif Koto,3,2024-07-06 00:24:44,"Game nya bagus tapi ada kekurangan nya, kenapa aku main game nya itu semua yang di sekitar ku jadi hitam jadi nya aku ga bisa genikmatin game ya tolang di perbaiki itu juga udah aku pake grafik paling rendah tetap aja di sekitar ku hitam semua jadi tolong di perbaiki."
com.HoYoverse.Nap,Nashich Ulwan,4,2024-07-06 00:23:24,"Game nya udah bagus, cuman rada gak kompatibel di hp saya. Dijamin ngecrash ketika 20 menit bermain. Padahal game berat lain (seperti wzm dan wuwa) walaupun sampai panas gak bakal ngecrash, tapi game ini mentok anget malah ngecrash (tanpa pemberitahuan suhu tinggi atau apapun itu)."
com.HoYoverse.Nap,I Made Dwi Asta Devandra,5,2024-07-06 00:20:06,👍
com.HoYoverse.Nap,Shugo Kitte,1,2024-07-06 00:17:13,Scam bilangnya 100 pulls
com.HoYoverse.Nap,Rizqullah,5,2024-07-06 00:13:47,Ada banyak permasalahan untuk beberapa device bro mihoyo mungkin bisa diperbaikin spek temen saya lebih bagus namun dia blackscreen 😅
com.HoYoverse.Nap,ShrimpCH,5,2024-07-06 00:13:40,Game ini sangat keren dan sangat menakjubkan dan sangat sangat wajib dimainkan dikarenakan game ini sangat amat baik dan tidak kikir seperti wuthering waves dan genshin impact dan juga honkai star rail dikarenakan saya tidak mendapatkan ruan mei semoga kedepannya zenless zone zero tidak kikir dan baik seterusnya dan semoga saya tidak mendapatkan hard pity dan akan mendapatkan ellen c6 dan saya akan memainkan game ini terus disaat saya ada waktu luang tidak sprti org yg tdk prnah menyentuh rumput
com.HoYoverse.Nap,adnan,5,2024-07-06 00:12:44,GEMNYA SANGAT SERU!!! GA NYESEL NUNGGUIN 2000 TAHUN! Suka banget sama game game adu jotos kaya gini!
com.HoYoverse.Nap,Dewa,5,2024-07-06 00:11:54,Mantap
com.HoYoverse.Nap,Wolfgang Von Hellsing,5,2024-07-06 00:07:48,"Fresh gameplay, i like it"
com.HoYoverse.Nap,Romy Raditya Aji,5,2024-07-06 00:07:01,Cara ngasih ulasan review gimana sih? Apa setelah ini klik kirim terus udah keposting?
com.HoYoverse.Nap,Timmy L.S.T,5,2024-07-05 23:59:44,good
com.HoYoverse.Nap,Mita Hijriati,1,2024-07-05 23:48:46,"tolong dong ini kenapa sering force close, padahal genshin hsr lancar jaya tolong di optimalkan lagi padahal seru gameplay nya"
com.HoYoverse.Nap,Door,5,2024-07-05 23:41:18,Smooth parah gem nya mantap
com.HoYoverse.Nap,Muhammad Rozi,1,2024-07-05 23:35:51,Hilangkan TV Masak Game 17GB explorenya cuma segitu
com.HoYoverse.Nap,ADIN MULYANA,4,2024-07-05 23:26:13,Please fix bug cutscene yang ngelag
com.HoYoverse.Nap,O-ZI,1,2024-07-05 23:18:40,Belasan gb cuman buat game adu jotos 😀
com.HoYoverse.Nap,Muhamad Wildan,1,2024-07-05 23:14:52,Tidak tertarik Terlalu ramai visualnya ketika di open worldnya
com.HoYoverse.Nap,Para,4,2024-07-05 23:11:00,kurang optimalisasi nya lagi buat hp mid range
com.HoYoverse.Nap,Temperatur Merah,1,2024-07-05 23:05:40,Gachanya busuk
com.HoYoverse.Nap,Avi Dan1310,5,2024-07-05 22:59:40,Mantap
com.HoYoverse.Nap,kizuma Hayakuya,5,2024-07-05 22:46:00,aman aja di gw :v
com.HoYoverse.Nap,Arya Choirul Fikri,5,2024-07-05 22:41:24,Nice
com.HoYoverse.Nap,Marcopolo,4,2024-07-05 22:35:13,"A good start, hopefully soon as possible 45 fps add on setting. It help for mid device"
com.HoYoverse.Nap,Miftahul Hikmah,5,2024-07-05 22:28:49,"Tolong dikurangi pemakaian RAM-nya. Apalagi ketika LIVE2D, khususnya gacha dan trial char"
com.HoYoverse.Nap,karim themax,5,2024-07-05 22:27:45,Sumpah size 17GB wow dengan grafik yang di tawarkan sesuai maka tak heran sih story dan gameplay menarik memang wajib di download nih oh iya kalian kalau mau download siapin spek minimum snapdragon 855 ram 8gb wajar kalau spek low ngelag jangan di paksa untuk devnya semoga kedepannya lebih baik lagi banyakin event menarik yah ♥️
com.HoYoverse.Nap,Ahmad,5,2024-07-05 22:26:46,Seruu banget
com.HoYoverse.Nap,carry ifandel,2,2024-07-05 22:20:37,Ini gimana dah... Setiap x jari deket kamera depan layar game nya gelap sendiri... Masa iya main nya harus pake 1 tangan
com.HoYoverse.Nap,23-059 Ahmad Farhan,5,2024-07-05 22:17:31,"Overall bagus gamenya memenuhi ekspektasi saya, gamenya juga GK terlalu berat settingan medium masih lancar jaya, cuma saran agar hadiah tinet untuk gachanya diperbanyak lah, Untuk battle nya saya dah puas sistem combo Parry nya mantap"
com.HoYoverse.Nap,Kou kun,5,2024-07-05 22:01:17,"Very cool games and stylish,love the environment and character the songs is great too the best hoyo games from my opinion and this games is different from any hoyo games it didn't feel like hoyo gacha games it's feel like japanese anime games which is good"
com.HoYoverse.Nap,idris putro,1,2024-07-05 22:00:49,terlalu sulit untuk di kontrol dan terlalu rumit mekanisme gameplaynya
com.HoYoverse.Nap,Tri Muhamad Nur,4,2024-07-05 21:58:48,"Gw suka gama ini asik menurut gw, cuma masalahnya berat banget ini game di mobile, dari setiap game mobile yang pernah gw mainin ini doang yang paling berat. Semoga Dev bisa membuat game ini jauh lebih ringan terimakasih."
com.HoYoverse.Nap,Kvischik Gap,1,2024-07-05 21:56:07,"Game apa ini hitam doang, yang muncul cuma musuh sama karakter yang di kendalikan saja. Sisanya full HITAM, minimal kalau buat game yang niat dikit lah di optimasi grafiknya masa game grafik cacat kek gini udah dirilis. Padahal genshin impact di hp ku gak ada masalah sama sekali, yang bermasalah cuma ini game sama HSR. Benerin lah jangan cuma kau balas pakai bot lalu kau kacangin udah kek KOMINFO aja. Saya mendownload dari GOOGLE PLAY STORE DAN SUDAH VERSI TERBARU"
com.HoYoverse.Nap,Juned Abd,5,2024-07-05 21:42:58,"Masih sering force close nih, tolong dong dibenerin. Saya pakai device ROG 5"
com.HoYoverse.Nap,Antoni G,1,2024-07-05 21:37:11,Maaf kurang menarik. Game play tipi turu
com.HoYoverse.Nap,Reina,1,2024-07-05 21:36:51,"Booring combat, UI nya belibet ga enak dipandang, simulai TV nya sok asik & desain char kurang."
com.HoYoverse.Nap,Jonathan octaviano Suwignyo,5,2024-07-05 21:36:48,Keren
com.HoYoverse.Nap,Andre Nicholas,5,2024-07-05 21:33:58,Nice
com.HoYoverse.Nap,Mangga Muda,5,2024-07-05 21:12:00,bagus
com.HoYoverse.Nap,Stenly Gabriela,5,2024-07-05 21:07:45,"Perpaduan warnanya nyaman dimata, karakternya juga unik²"
com.HoYoverse.Nap,Fery YN,2,2024-07-05 21:07:20,Map hitam
com.HoYoverse.Nap,Azel Azarya Alditranuari,5,2024-07-05 21:05:19,Mantab
com.HoYoverse.Nap,Muhamad Riyan Hafiz,4,2024-07-05 21:00:04,"terus terang, game nya seru!.. grafisnya juga bagus tp masih bingung sama penampilan UI nya ada terlalu banyak warna yang ke highlight & lumayan banyak pernak pernik walaupun ada pengaturan warna, tp tetap berasa ngg nyaman & ternyata login screen nya cukup banyak, jadi mau apa"" ada jeda loading, jadi gameplay nya terasa lebih lama"
com.HoYoverse.Nap,Gilang Permadi,1,2024-07-05 20:51:05,"50 GB for pc and 17 GB on phone is hella crazy for a game like this. Comic slide for cutscene. Awful boring type of dungeon crawling. In game reward that not rewarding player at all. No wonder the title is ZZZ, I almost fell asleep playing this game. HI3 is much better."
com.HoYoverse.Nap,RyouTa KenZ,3,2024-07-05 20:49:40,Masih banyak terdapat bug Suara audio ingame sangat kecil sehingga harus full volume agar terdengar Terlalu banyak memakan ram Controller jika sudah lama bermain tiba tiba tidak bisa di pencet padahal masih terkoneksi Device Poco F3
com.HoYoverse.Nap,Suka suka,1,2024-07-05 20:40:21,"ngak bisa login (terlalubanyak request ),, speed donload lemot banget"
com.HoYoverse.Nap,Sabar Udin,1,2024-07-05 20:38:09,"Grafik gak ada masalah, masalah nya cuma fitur TV tabung nya menggangu bikin ngantuk"
com.HoYoverse.Nap,Rifki,5,2024-07-05 20:31:46,Nice
com.HoYoverse.Nap,Ade Surya,1,2024-07-05 20:29:43,Game kikir part 2 kedip kanan
com.HoYoverse.Nap,Never Sleep,5,2024-07-05 20:25:34,already download where my 180 pulll free
com.HoYoverse.Nap,Bayu Risnata,3,2024-07-05 20:14:14,Tolong dong min perbaiki game nya supaya GK black screen lagi
com.HoYoverse.Nap,vins Dragnel,5,2024-07-05 20:14:11,Lets goooo too battel 🤩🤩🤩
com.HoYoverse.Nap,andrian dp,3,2024-07-05 20:09:13,"Game ngantuk zzz Saran saya aja untuk mode tv itu dibikin mini game aja, masuk dungeon pengen gebuk2 musuh malah dikasih puzzle, boring lagi"
com.HoYoverse.Nap,Risqi Lazuardhi,1,2024-07-05 20:05:24,B aja
com.HoYoverse.Nap,Prasetya Etris,5,2024-07-05 20:03:41,Mantap
com.HoYoverse.Nap,Mochamad Sahid,2,2024-07-05 19:59:38,Snapdragon 870 masih frame 💀
com.HoYoverse.Nap,Sapikon,5,2024-07-05 19:51:25,berikan banyak bansos gem baik🥰
com.HoYoverse.Nap,Galih Satya Pramana,2,2024-07-05 19:49:16,"Entah hp saya yang spek rendah atau emang nge bug, world gamenya item semua bjir"
com.HoYoverse.Nap,Fithrah Alfarisi,2,2024-07-05 19:47:18,"Up grafik!! Udah high grafik masi aja burik, setarain ama genshin kek, mihoyo masak burik si?"
com.HoYoverse.Nap,SEELE VOLLEREI,5,2024-07-05 19:39:12,"Buat yang pada ngeluh pas mau login layarnya hitam, loading sering force close, disuruh kosongin penyimpanan lagi ,atau apalah. Itu sebenarnya device lu kurang support, kalau Layarnya hitam artinya device lu ga kuat nge-render grafiknya,kalau masih maksa main yang ada hp lu rusak duluan [bisa"" MATOT] Ini bukan masalah bug dari gamenya atau ukurannya tapi masalah di device masing"". Gw aja main ga ada apa"" ,aman aja tuh. [Overall nih game bagus dari segi gameplay ataupun grafik]"
com.HoYoverse.Nap,Korea Daebak,1,2024-07-05 19:34:25,game scam
com.HoYoverse.Nap,Jolin Jolin,4,2024-07-05 19:31:52,Okee game baru rilis gaada masalah sama mapnya tapi tiba tiba force close sendiri semoga segera di fix yah 😁🙏🙏
com.HoYoverse.Nap,Yuda 20,1,2024-07-05 19:04:44,Game ngantuk ngebosenin bansos juga kaga ada👎
com.HoYoverse.Nap,laurel,5,2024-07-05 18:53:11,best game :)
com.HoYoverse.Nap,Diaz Ahmad F,5,2024-07-05 18:52:28,bagus aja sih gameplaynya enjoy aja bagiku tapi kalo dah yang bagian TV ampun gweh mah ✋😂🤚 kadang ribet selesaiinnya dan mohon di optimalisasi kan lagi gamenya! snapdragon 860 masih patah2 ya maklum ram HP saya 6
com.HoYoverse.Nap,Muhammad Aulia Ramadhan,5,2024-07-05 18:45:40,"Kok aku main rata kiri malah keluar sendiri ya, padahal udah pake device iphone 15 pro max"
com.HoYoverse.Nap,Jujun Naedi,5,2024-07-05 18:44:27,"Sejauh ini masih aman main di Chipset naga 778G ,masih tergolong bersahabat untuk hp gue, mantap Z.Z.Z👍"
com.HoYoverse.Nap,Shirokysa,1,2024-07-05 18:43:36,King
com.HoYoverse.Nap,DZ Gaming,1,2024-07-05 18:42:06,Kok gini
com.HoYoverse.Nap,Kevin Michael Wijaya,5,2024-07-05 18:39:45,Mantap seru coyy
com.HoYoverse.Nap,Muhammad Zaky Zahran,5,2024-07-05 18:30:02,"ini game lancar2 aja dah. knp banyak yg spam 1 coba. gw coba di 13T Dimensity 8200 ama ipad M1 lancar rata kanan jg. kan emg minimal Snapdragon 855 atau dimensity 1200 keatas rekomendasi nya. baca deskripsi makanya bang . kalo pake kaya dimensity 7000, 6000 apalagi helio g series dan Snapdragon 600 an kebawah jgn maksain, sadar device dulu🙄"
com.HoYoverse.Nap,Terlanjur Jago,4,2024-07-05 18:23:29,"Unik sih gameplaynya, cuma ya kurang compatible aja d Android, smoga d perbaik"
com.HoYoverse.Nap,Yusdi Darmawan,1,2024-07-05 18:22:28,Kenapa harus pakai televisi jadi males mainya
com.HoYoverse.Nap,Afif Robert Fikriyan,5,2024-07-05 18:11:26,"Game ini sangat seru untuk sekelas game gratis, saya bersyukur punya kesempatan untuk memainkannya (karena device saya dewa)"
com.HoYoverse.Nap,Andi Saifullah,5,2024-07-05 18:07:58,"Simpel, enak, bisa lancar 40-50 fps set low-medium di Mi 8 jadul, padahal masih pake SD 845 MIUI 12 (android 10). Paling pas cutscene yg nampilin 3 orang agak framedrop ke 20-an fps."
com.HoYoverse.Nap,Raden Jaka Eka Saputra,1,2024-07-05 18:03:48,"masalah grafis ini rajanya,. tapi tolonglah TV yang ada di game ini hilangkan, ini game 99% TV, 1% battle.. 😢"
com.HoYoverse.Nap,Moh. Robby Yahya,1,2024-07-05 17:53:57,Penipuan bansos katany free pull manaaaaaaaaaaa iklannnn doanggg
com.HoYoverse.Nap,fre cat,5,2024-07-05 17:47:42,aku cinta lycaon 💋
com.HoYoverse.Nap,Scythe Luzt,1,2024-07-05 17:47:06,"Tidak optimal di android, khusus saat membuka menu gacha dan toko langsung force close, tapi saat bermain di kota/ pertempuran ini lancar 60fps.... Saya merasa ini bukan masalah device saya,sangat tak masuk akal. Saya berjanji akan menilai ★5 setelah masalah ini diperbaiki.."
com.HoYoverse.Nap,julio ardinata,5,2024-07-05 17:46:11,Hp gk kuat gk maksa lah sok sok kasih bintang satu
com.HoYoverse.Nap,Solo Leveling,1,2024-07-05 17:43:31,Gem gak jelas
com.HoYoverse.Nap,Muhammad Azhar,5,2024-07-05 17:40:02,Game nya seru... Semoga terus berkembang nih game!!!
com.HoYoverse.Nap,Jeichiiro,5,2024-07-05 17:39:44,nicole wangy:3
com.HoYoverse.Nap,Claris,5,2024-07-05 17:39:15,Okelah 🗿👍
com.HoYoverse.Nap,Marfiel Mandolang,1,2024-07-05 17:37:46,Mana 100 tiketnya ?
com.HoYoverse.Nap,Zenless Zone zero,5,2024-07-05 17:32:45,"Bagus game ya... Tapi mungkin bisa lebih dioptimalkan lagi, biar bisa lebih smooth game play ny"
com.HoYoverse.Nap,All stilllearning,5,2024-07-05 17:23:07,Sangat bagus banyakin karakter tobrut
com.HoYoverse.Nap,Renzu,1,2024-07-05 17:21:55,No 100 free pulls
com.HoYoverse.Nap,Microba Kyuu,5,2024-07-05 17:18:38,"Sangattttt bagusss animasinya, device mid lancarr jaya best optimasi, bansos banyak daripada hsr, game baik"
