app_id,userName,score,at,content
com.HoYoverse.Nap,Roy alfiyanto,5,2024-12-22 19:02:03,"Akhirnya mode tv ilang, saran kalo bisa hollow zero yang bunga di ilangin mode tv-nya males banget main hollow zero kalo masih ada mode tv dan kalo bisa bossnya jangan susah"" kasian yang baru main harus nunggu waktu lama biar bisa kelar mode hollownya, terima kasih."
com.HoYoverse.Nap,Scara Scar,5,2024-12-22 17:54:21,I LOVEE THIS GAMEE SM
com.HoYoverse.Nap,Fahri yunir,5,2024-12-22 17:21:01,1.4 patch its just tooooooo goooooodddd
com.HoYoverse.Nap,Zidan Rusdiansyah,5,2024-12-22 15:58:11,Sehat-sehat game baik
com.HoYoverse.Nap,Pratama Berdinanto,1,2024-12-22 15:05:35,Masa iya gatcha pertama rate off game kikir
com.HoYoverse.Nap,Dhany Ramdhany,4,2024-12-22 14:58:21,"Saran buat developer untuk menambah kan settingan kontras cahaya soalnya agak over aja, dan untuk character/agen agak berbeda dari yang di banner mungkin kurang optimalisasi di Android aja tapi yang di pc udah oke"
com.HoYoverse.Nap,Raiza Mahendra,3,2024-12-22 12:01:24,game ini ngga rekomendasi untuk hp di bawah prosesor heliog99 karnah game nya cukup berat tapi alur cerita nya baguss
com.HoYoverse.Nap,Abd Muhid,1,2024-12-22 11:52:41,"Rate off mulu ah capek, g pernah menang rate off"
com.HoYoverse.Nap,Bagus Hidayat,5,2024-12-22 10:22:31,"Game ini adalah yang terbaik mulai dari segi pengembangan karakter yang mudah, ceritanya bagus sekali, serta developer juga sangat memperhatikan Player dengan secepatnya melakukan penambahan , perbaikan fitur game sesuai saran dan keinginan player. Mantap lah hoyoverse"
com.HoYoverse.Nap,Lone Narch,1,2024-12-22 10:16:09,"Semalem main tapi ketiduran dan pas bangun hp mati, pas buka game nya lagi akun udah logout dan pas mau login malah ada tulisan ""terlalu banyak permintaan, silahkan coba lagi dalam beberapa saat"" Nunggu satu jam dua jam masih gak bisa, tapi pas di coba login di laptop teman itu bisa tanpa masalah"
com.HoYoverse.Nap,Kenzie Syandana,5,2024-12-22 09:31:36,Peak Update
com.HoYoverse.Nap,Zak - Sama,1,2024-12-22 07:27:58,"Kenapa setelah UPDATE GAME di Patch 1.4 ini di Smartphone FPS nya jadi tidak stabil.. suka drop, patah-patah, padahal saya memakai Snapdragon 8+ gen 1 di ROG 6 PHONE.. FPS yg di peroleh menjadi hancur berantakan! Saya mohon segera di FIX masalah bug ini, kalau ini masih belum selesai, saya akan UNINSTAL ZZZ dengan terpaksa. Terimah Kasih."
com.HoYoverse.Nap,PG videos,5,2024-12-22 05:15:10,Optimalisasinya lebih di tingkatkan lagi biar bisa lebih banyak mencakup hp kentang hehehe
com.HoYoverse.Nap,Mario X,5,2024-12-22 01:00:06,"Game zzzzzzzzzzzzzzzzzzz Tolong dioptimalkan untuk device menengah, device saya bermain game hoyo yang lain di grafik medium tidak ada masalah tapi di zzz ini lag banget untuk grafik low, semoga kedepannya performa meningkat"
com.HoYoverse.Nap,Jani Liebert,1,2024-12-22 00:35:13,Kenapa gak ada fitur matiin bayangan ngelag boss mending buat fitur itu dulu dah dari pada buat karakter yang tobrut tobrut
com.HoYoverse.Nap,Malang Indah,5,2024-12-21 22:55:06,Hoyoverse kapan ada dubbing Indonesia di game mu ini?
com.HoYoverse.Nap,M. Fritzy fawwaz,5,2024-12-21 22:14:22,The best RPG game that i ever played
com.HoYoverse.Nap,Fatwa Ikhwan Haq,5,2024-12-21 22:00:22,"Setelah update 1.4 bermain jadi lebih berat, mohon optimalisasi di device android Mi 10T Pro Snapdragon 865"
com.HoYoverse.Nap,Nizam Ar,1,2024-12-21 20:10:55,Komputer nya di hapus aja buang buang waktu kalo itu
com.HoYoverse.Nap,nana yulianti,5,2024-12-21 19:55:34,"HeroZo disini! Setelah dapet Miyabi, hidupku terasa lebih berwarna🤩"
com.HoYoverse.Nap,Myon,5,2024-12-21 19:20:06,"I love this game. It feels like i was living in a videogame, a home i belong to, thankyou so much hoyo for making this game, i hope for the best for ZZZ!"
com.HoYoverse.Nap,M. Raka Saputra,5,2024-12-21 19:19:37,dipaksa pensi sama device
com.HoYoverse.Nap,Bang Rey,4,2024-12-21 18:35:11,Lumayan
com.HoYoverse.Nap,azis firmansyah,5,2024-12-21 18:24:32,untuk update 1.4 ini terjadi lag yang cukup parah di dalam setiap battle di pengguna mobile.dimohon bantuannya pihak developer untuk optimalisasi kendala tersebut. untuk reward2 yang diberikan sangat membantu. terimakasih
com.HoYoverse.Nap,Farrel GTSee,2,2024-12-21 18:12:36,"Sejak di update jadi sering frame drop padahal sudah nurunin grafik ke paling rendah, dan masih terjadi frame drop dan itu sangat mengganggu, hp saya poco x6 pro."
com.HoYoverse.Nap,Miray Yochiver_,1,2024-12-21 17:49:50,"KNP GACHA NYA BAUK BGT SIH, masa dri saya awal main ga pernah hoki, dan juga tolong kurangin mode TV itu membuat saya pusing,mual,dan bosan"
com.HoYoverse.Nap,Muhammad Aldi Saputra,1,2024-12-21 15:33:57,"Maaf saya turunin bintang nya 🙏 Tolong untuk rate gacha nya diperbaiki, masa harus selalu diatas 80an gacha biar dapat karakter limited rank S ditambah lagi selalu rate off, jadi harus ngumpulin total 160an gacha lebih untuk mengambil karakter limited rank S. dari semua game hoyoverse cuman zzz yang rate gacha nya paling parah, kalau kayak gini terus auto pensi main ini game mau koleksi karakter aja susah"
com.HoYoverse.Nap,jope Dev,5,2024-12-21 14:10:04,"Saya suka sekali dengan game ini, ayolah hoyo kembalikan tier s di sinyal!!"
com.HoYoverse.Nap,Satrio Utama,5,2024-12-21 13:22:26,Mau 1st annivesar
com.HoYoverse.Nap,Erul Kasep,5,2024-12-21 12:42:46,Game nya seru dan gameplay juga asik sama sub dan petualangan nya mantap sama misi nya juga gampang di pahami
com.HoYoverse.Nap,Arif Argus,5,2024-12-21 11:31:13,Hentai
com.HoYoverse.Nap,Didan Ramdan,5,2024-12-21 10:45:53,best game ever
com.HoYoverse.Nap,Farid Alhabsyi,5,2024-12-21 08:38:41,Gua suka banget game ini tapi kalian harus siapin ruang 25 gb buat download datanya tapi walupun sebanyak itu aku sih puas sama game bagus ini dan karakter cewenya itu pada cantik dan seksi loh 😅😅😅
com.HoYoverse.Nap,lily nuf,1,2024-12-21 08:11:59,"ada bug visual, efek chr malah jadi silau banget"
com.HoYoverse.Nap,Defri Adysta,5,2024-12-21 05:13:06,Game baik
com.HoYoverse.Nap,WereWolf Ichika,2,2024-12-21 03:33:20,"Developer tolong , pas udah download , dalemnya kenapa download lagi dan gak bisa download , padahal saya ram masih banyak kenapa gak bisa di download dalemannya ya , tolong developer di coba lagi...... Udah saya hapus semua app yang saya punya tapi tetap gak bisa.... Tolong developer"
com.HoYoverse.Nap,Sandhika Dwi Saputra,1,2024-12-21 00:23:11,cukup tw
com.HoYoverse.Nap,Flynn,3,2024-12-20 18:59:38,"Nggak masuk akal susah banget game nya, ngebuild karakter sih sebenarnya masih gampang gampang aja tapi kalok pas mau ngerjain quest susah banget sumpah........ 😭😭😭😭😭😭, sistim gacha nya juga ngg ngotak banget, udah sih itu doang. sebenarnya game nya bagus aku suka tapi ya itu agak susah di mekanik nya aja, Oh iya ini game ""PAY TO WIN"" ya Btw... Jadi nggak usah berharap lebih...😁"
com.HoYoverse.Nap,Voreno Wardana,5,2024-12-20 16:51:12,Game baik banget asli dah cobain klo gk percaya🤩🤩🤩
com.HoYoverse.Nap,Kevin Ezar,1,2024-12-20 16:16:32,sumpah jan di download game kikir
com.HoYoverse.Nap,Husnu AL Huda,1,2024-12-20 15:56:23,"Game ampas gk jelas, dikit dikit update, dikit dikit update, mo maen aja ribet"
com.HoYoverse.Nap,AiRi,5,2024-12-20 15:27:36,Game apaan ini!!!!!!! Sumpah satisfying bet combat nya gila... Combat nya terlalu bagus.
com.HoYoverse.Nap,chal bro 047,1,2024-12-20 14:22:49,"Setelah update jadi ngelag sampai nge crash, padahal sebelum update masih lancar"
com.HoYoverse.Nap,Idho Wa,5,2024-12-20 13:36:54,Sangat menyenangkan karena saya berhasil mendapatkan suami saya ( lighter)
com.HoYoverse.Nap,Sance Kece,3,2024-12-20 12:55:24,Kebanyakan misi. Misi yang 1 belum selesai udah dikasih misi lagi jadi bingung mau nyelesain yang mana dulu ditambah naikin levelnya dipersulit
com.HoYoverse.Nap,Rahadian Eka,1,2024-12-20 12:34:24,ga kompe
com.HoYoverse.Nap,Tri HS,1,2024-12-20 12:30:48,"Update versi1.4.0 kok sekarang sering patah²?, padahal versi sebelumnya aman ,main high 60fps / 30fps lancar, sekarang main di setting 30fps/60fps patah² drop fps 😑"
com.HoYoverse.Nap,Sholiqin Hafiz,5,2024-12-20 10:00:03,Game nya bagus aja kok ini tuj game buat orang yang menikmati cerita blok bukan game yang terfokus Kombat dong blok Dan juga buat orang orang yang bilang ni game susah itu berarti lo aja yg botttttttt 😝
com.HoYoverse.Nap,Wahyu Saputra,3,2024-12-20 08:12:35,Tolong la Developer perbaiki sistem login gem nya menurut saya login ke gem nya terlalu lama banyak banget yang harus di download sebelum masuk ke genya khusus update terbaru Zenless Zone zero kali ini dalam update V 1.4
com.HoYoverse.Nap,J1 Ace,4,2024-12-20 07:49:17,"Kasih fitur zoom out,kaya di hsr!!!"
com.HoYoverse.Nap,Setya Nova,1,2024-12-20 07:46:23,I still can't enjoy the game. Too much Comedy and it clashes with the Post Apocalyps theme.
com.HoYoverse.Nap,Muhammad Hidayatullah,5,2024-12-20 07:34:11,"Baru aja main nih game, gacha chara miyabi eh langsung dapet😂, aseli semenjak dapat tuh chara, nih game jdi mudah banget🤤"
com.HoYoverse.Nap,Rosihan Saputra,5,2024-12-20 07:20:50,"Game nya bagus dan dah gak banyak mode TV nya sekarang sudah banyak kombat yg bagus, semoga kedepannya menjadi lebih bagus"
com.HoYoverse.Nap,Ahmad Nizam Pratama,5,2024-12-20 06:42:46,"Aku sangat senang, bisa bermain game menyenangkan seperti ini"
com.HoYoverse.Nap,Bayu Laksono,1,2024-12-20 06:20:32,Gachanya ampas selalu dapet pity besar trus gak pernah hoki main ni game
com.HoYoverse.Nap,Aufa Yudikha,3,2024-12-20 04:13:03,untuk kedepan game nya di optimalin lagi
com.HoYoverse.Nap,Percival,1,2024-12-20 03:10:29,"Oke mantap mode tv udh hilang, tpi tetap b1 krna gacha di ini game terlalu busuk"
com.HoYoverse.Nap,shadiw,5,2024-12-20 00:01:08,"Desain Karakter bagus-bagus. Dan yang paling saya suka itu Animasinya, sangat-sangat mulus sekali pergerakannya, apalagi pas Cutscene. Good job buat yang bikin Animasinya."
com.HoYoverse.Nap,joey mi,4,2024-12-19 23:43:56,"Game hoyo memang bagus-bagus, cuma untuk zzz kali ini memang agak susah dari ui nya karena mungkin saya memang belum terbiasa(salah satunya quest,build char), berbeda dengan hsr dan gi yang bisa langsung saya pahami tidak membutuhkan waktu lama. lalu terkadang saya memiliki masalah perihal login, saya adalah orang yang suka hapus dowload game, saat saya ingin login hsr menggunakan akun x, entah mengapa selalu susah login padahal saya sudah memasukan usn dn pasword yang benar."
com.HoYoverse.Nap,Gana M,5,2024-12-19 23:15:11,Best gameeeeeeee
com.HoYoverse.Nap,Just- J,5,2024-12-19 21:21:21,1.4 is beyond absolute cinema. Big improvement for all aspect. Thanks for adding dating simulator.
com.HoYoverse.Nap,Ari Rahmad,3,2024-12-19 21:18:07,"Ini kenapa ya pas saya main kok selalu ngeframe padahal main genshin impack lancar-lancar aja, device ku iqoo 12 ada yg sama?"
com.HoYoverse.Nap,Abiyyu,5,2024-12-19 21:16:16,"Chipset naga 8** serasa jadi hp kentang main ini game jir lah. B5 aja dah, Aku setia nunggu optimalisasinya sambil nabung buat beli hp baru"
com.HoYoverse.Nap,Aditya Game,1,2024-12-19 21:02:18,"Tolong di evaluasi rate gachanya, 3 kali berturut - turut hard pity (75+) semuanya rate off dan perlu hard pity lagi untuk mendapatkan agen B5 limited, saya merasa setelah update versi 1.2 rate gachanya rusak."
com.HoYoverse.Nap,ANDHIKA DWI AL HAKIM,5,2024-12-19 20:47:46,Makin optimal 👍
com.HoYoverse.Nap,andy gunawan,5,2024-12-19 20:42:01,Yoshaa
com.HoYoverse.Nap,Samuel Rhesa,5,2024-12-19 19:57:33,"Diawal rilis optimalisasinya sangat buruk, sering frame drop dan bikin hp panas bgt, sekarang sudah improve optimalisasi nya jadi udh gk frame drop lgi dan bisa dimainkan dengan nyaman"
com.HoYoverse.Nap,Alann Nn,5,2024-12-19 19:53:22,"game bagusss, tapi kenapa berat bangetttt"
com.HoYoverse.Nap,M Dharma Maulana,5,2024-12-19 19:43:29,Terimakasih telah membuat character Miyabi yang gameplay nya bagus bgt :)
com.HoYoverse.Nap,AN1A_Pagi _Daffa Fauzaan Argi,5,2024-12-19 19:24:18,BIG W
com.HoYoverse.Nap,pandu kurnia,1,2024-12-19 18:51:38,Please fix your bug. kenapa sehabis update game ini selalu lag
com.HoYoverse.Nap,Faisal Firmansyah,5,2024-12-19 16:04:08,"Good improve game, Ya awal awal ni game rilis lumayan bosenin gameplay nya cuma makin sini gameplay nya makin berkembang dan banyak fitur fitur menarik sih, dan juga character"" nya yang jadi nilai jual tinggi, keep improve, this game to good"
com.HoYoverse.Nap,Syafiq,5,2024-12-19 14:07:23,keren
com.HoYoverse.Nap,Drajat Agung,5,2024-12-19 13:52:37,Very great
com.HoYoverse.Nap,Muhammad Diki Pasakpangan,5,2024-12-19 12:59:39,Good Game
com.HoYoverse.Nap,iyan,5,2024-12-19 12:02:46,kak ak hoki trus di gem ini jdi kasi bintang lima y
com.HoYoverse.Nap,Mo2n Strife,5,2024-12-19 11:31:45,"Game action RPG terbaik, grafis, cerita, sound, overall sangat memuaskan"
com.HoYoverse.Nap,Kholis Sihabudin,5,2024-12-19 11:08:28,Good job mode tv turu udah ilang. Tinggal kedepannya semoga untuk mobile lebih dioptimasi lagi.
com.HoYoverse.Nap,antira heck,1,2024-12-19 10:26:22,game qiqir
com.HoYoverse.Nap,Yon Chan,5,2024-12-19 09:34:51,"Unique and fun gameplay, lots of cool prizes and events, keep improving dev ZZZ🔥🔥🔥"
com.HoYoverse.Nap,Rivan Q 990,4,2024-12-19 08:26:24,Hoyo kenapa verifikasi Gmail yang ku buat untuk login malah berbeda dari Gmail yg di gunakan pada saat membuat akun tersebut ? Mohon bantuannya hoyo
com.HoYoverse.Nap,Afif,4,2024-12-19 08:07:35,"Story bagus 4/5 | Animasi super mantap 5/5 | Gameplay superb 4.7/5 | Character Design mantap 4.5/5 | Music 4.8/5 | Gacha System seperti hsr 3.5/5 | F2p Friendly 4/5 | Vibe 4/5 | Minus ini game cuma di size terlalu besar woi untuk genre yg bukan open world dan dimana mana loading, plus di ps5 untuk lokasi seperti lumina square sering frame drop | [Overall Rating 4.2/5]"
com.HoYoverse.Nap,Yume Hime,5,2024-12-19 07:25:52,"1.4 absolutely amazing! Peak story and full of motivation. But, the stupid think is they censored character when user looking character from low angle the character will disappear. How stupid when dev create gooner character like Burnice but they taking away the best essence they have. Edit: dev already solved. Thank you Hoyoverse"
com.HoYoverse.Nap,Suwandî Jøhan,1,2024-12-19 05:49:20,Update 1.4
com.HoYoverse.Nap,Redriel,5,2024-12-19 04:07:04,Terima kasih game baik Mungkin akun saya dinaikin lagi rate gachanya biar makin wangi 😍🥰
com.HoYoverse.Nap,khebot,2,2024-12-19 01:20:05,Ga bisa login selalu coba saat lagi
com.HoYoverse.Nap,Kyrie,5,2024-12-19 00:43:33,Nice
com.HoYoverse.Nap,Guntur Adham Syahputra,1,2024-12-19 00:33:36,"RNG gacha di game ini sangat busuk, menyiapkan 25K polychorme hanya untuk mendapatkan karakter saja, selalu dapet rate off dan pity sangat tinggi di setiap versi. Saya bermain dari awal versi dan gacha saya selalu buruk dan saya sangat kecewa sekali tidak ada rasa yang menyenangkan bermain game ini. keinginan untuk mendapatkan w-engine signature tidak pernah terlaksana karena polychorme sudah habis duluan karena gacha karakter yang terlalu mahal untuk di dapat."
com.HoYoverse.Nap,Mwull,5,2024-12-19 00:30:58,"dari segi animasi, visual, dan penggambaran dari karakternya bagus, animasi nya juga seakan akan hidup, banyak banget yang gerakannya hidup, ga kayak genshin..."
com.HoYoverse.Nap,Nuuu,1,2024-12-18 23:54:39,"Ayo lah tolonglah GACHANYA dibuat bersahabat masa 2 banner berturut turut rate off MIKIRLAH w udh ikutin dari zaman honkai>genshin>hsr gak pernah sekecewa ini sama gachanya, kalau kalian pikir memberi kompensasi di pikir cukup? Gak bakal"
com.HoYoverse.Nap,Ade Putra,5,2024-12-18 23:47:45,ZZZ. Z-nya? Gem baik
com.HoYoverse.Nap,Ruineee,1,2024-12-18 23:40:55,gacha ampas.
com.HoYoverse.Nap,Leonidas Thunderlatte,1,2024-12-18 23:22:31,I'm against the censorship
com.HoYoverse.Nap,Andra,5,2024-12-18 23:02:24,Developer Baikk 👍🏻😁👍🏻
com.HoYoverse.Nap,Vertin Sonetto,5,2024-12-18 22:58:26,Oh ✋😭
com.HoYoverse.Nap,Evelyn Chevalier,5,2024-12-18 22:37:41,"Update versi 1.4 sangat memuaskan, ada sedikit masukan ""mungkin di update mendatang bisa unlock 90 fps untuk hp & laptop yang layarnya sudah support 120hz & Touch Sampling Ratenya 240hz"""
com.HoYoverse.Nap,Imam Dwi Hartanto,5,2024-12-18 22:30:53,YEY MODE TV DI GANTI HOREEEE
com.HoYoverse.Nap,Lone Wolf,5,2024-12-18 21:37:58,"Lancarin terus bansosnya mihoyo, jangan kikir"
com.HoYoverse.Nap,Muhammad Abduh,1,2024-12-18 21:23:52,"Dari awal game ampe sekarang, gacha w busuk mulu njer, selalu kalah 50/50 dan gitu di hard pity lagi, gk kek sodaranya yang lain, gacha enak-enak aja kadang bagus kadang ngak biasa, lah ini selalu kalah hard pity bikin males maen lagi njer. RNGnya parah dah ini '-')"
com.HoYoverse.Nap,Akzul Habirul,5,2024-12-18 21:19:02,Setelah update kenapa jadi lag gini yah mohon perbaiki yah mihoyo
com.HoYoverse.Nap,Eyy B0SSS,5,2024-12-18 20:49:29,Yang bilang game nya susah blablabla... Fix kalian itu skill issue 😹 Mending maen Balatro aja sana 😹
com.HoYoverse.Nap,QORI ILMAN,5,2024-12-18 20:17:23,Mantabbbb
com.HoYoverse.Nap,Jesika Putri,5,2024-12-18 19:45:13,"gila sii, dapet karakter gratis woyy. anjayy, makasihh zzz. dari segi story dan gameplay menarik, dengan desain karakter yang luar biasa‼️🌷"
com.HoYoverse.Nap,Ahmad Hamdan Rafi,5,2024-12-18 19:32:08,"Bagus, tapi tolong hp saya kentang"
com.HoYoverse.Nap,Ajeng Althofun,5,2024-12-18 19:22:39,terimakasih telah membuat game sebagus ini dan sekeren ini sehat selalu yaaa ♥️♥️
com.HoYoverse.Nap,Nipis,1,2024-12-18 19:04:24,"ga kompatibel lagi woilah, makin update makin g kompatibel😭😭"
com.HoYoverse.Nap,Ghany,1,2024-12-18 19:04:11,"aelah hoyo,gak pernah menang rate off gw njer harus rate on terus kalau mau gacha dah lah"
com.HoYoverse.Nap,M.Rayhan Putra Firdhan,1,2024-12-18 18:57:18,"Setelah update 1.4 Udh enggak bisa liat bagian bawah karakter lagi, bintang 1 otw Uninstall..."
com.HoYoverse.Nap,Rifqi Riandra,1,2024-12-18 18:43:35,Usai sudah😔
com.HoYoverse.Nap,vannilaa,5,2024-12-18 18:23:43,omg i loveeeeeee thissss gameeeee
com.HoYoverse.Nap,Allura AMV,5,2024-12-18 18:03:39,kereen
com.HoYoverse.Nap,Adi Juliansyah,5,2024-12-18 17:06:31,"Nah gini dong b5 gratis, sering sering ya"
com.HoYoverse.Nap,Muhammad Fiqih Al Fikri,5,2024-12-18 16:51:09,Rata kanan.. No celah. Btw yg bilang gamenya susah ingatlah SKILL ISSUEEE WLEEE
com.HoYoverse.Nap,Fadillah 04,5,2024-12-18 16:08:58,HOYOVERSE MEMASAK DI UPDATE INI🔥🔥🔥🗣🗣🗣
com.HoYoverse.Nap,Ezza Nugraha,5,2024-12-18 16:07:53,Mendingan ini dari genshin
com.HoYoverse.Nap,SAY HI! FIRS,5,2024-12-18 15:22:32,"Combat satisfying banget, TV mode bisa dikurangi porsinya, klo terlalu sering membosankan, tp jangan dihilangkan juga, krn bisa untuk refresh klo pas maen combat bosan. Story bagus. Cutscenenya sangat keren, animasinya luwes banget."
com.HoYoverse.Nap,Desta Azarya,1,2024-12-18 15:11:19,setiap login pasti download data 9000mb dan masih ada login lainya yang lama mungkin jika login nya lama terus saya lebih memilih untuk delete game ini daripada cuma mau login harus tunggu 30 menit pdhl penyimpanan masih ada sekitar 50
com.HoYoverse.Nap,Ongky S,1,2024-12-18 14:59:00,😐🙌
com.HoYoverse.Nap,Kirigaya Kazuto,5,2024-12-18 14:51:10,"Tahun 2024...mencoba game zzz..game nya keren dan seru,gameplaynta pun unik yaitu main tv aowkkw...ah gw suka Hoshimi Miyabi..i love you Hoshimi miyabi 😍"
com.HoYoverse.Nap,Raihan Dafi,5,2024-12-18 14:41:19,Kasih gw Miyabi atau gw b 1 lagi
com.HoYoverse.Nap,Boneka santet,2,2024-12-18 14:31:22,Tolong diperkecil Size Ruang gem nya Ini terlalu berat sampe 30 GB.
com.HoYoverse.Nap,Adang Kusnadi,5,2024-12-18 14:07:01,Walau sistem gacha nya ampas kaya gamenya yang lain tapi storynya bagus
com.HoYoverse.Nap,Ezra Yafi Sinaga,5,2024-12-18 14:00:45,Recomen
com.HoYoverse.Nap,Hate Away,5,2024-12-18 13:44:45,Version 1.4 is very good
com.HoYoverse.Nap,Arma Jaya,1,2024-12-18 12:57:22,Kenapa aku gak bisa masuk padahal aku dah hapus beberapa game sampai penyimpanan 57.7 GB apa masih kurang
com.HoYoverse.Nap,Mutiya 610,5,2024-12-18 12:57:03,"Setiap cutscene agak lag, tapi gpp"
com.HoYoverse.Nap,Muhammad Bintang Rizky Mahendra,5,2024-12-18 12:51:00,Worth it lah 10 gb buat ngerender susu 😋😋😋
com.HoYoverse.Nap,Chottomatte,4,2024-12-18 12:49:10,Tulung updatenya udah mulai extreme
com.HoYoverse.Nap,Rhido Arianda,5,2024-12-18 12:26:23,Nice game hoyo😙
com.HoYoverse.Nap,Adi Dwi (Adi),5,2024-12-18 12:18:23,Makin zeru aja nih game bikin ketagihan
com.HoYoverse.Nap,Ale Xeno,5,2024-12-18 12:12:47,Ampas bnget Gacha nya :v
com.HoYoverse.Nap,Yazid,5,2024-12-18 12:00:33,Hebat
com.HoYoverse.Nap,Lift Maxir,5,2024-12-18 11:58:10,"Seriusan keren bngt uptade 1.4 ini.. jadi ringan gamenya, jadi lancar bngt mainnya, mantap banget Hoyo, jadi makin betah mainnya"
com.HoYoverse.Nap,Guardiantales,1,2024-12-18 11:47:12,"Kalo ada orang yg bilang menang rate off jangan percaya, itu mitos"
com.HoYoverse.Nap,Mika Mika,4,2024-12-18 11:32:05,bug GK bisa download di hp Poco m5
com.HoYoverse.Nap,Safira Putri v.,5,2024-12-18 11:21:21,"Sangat suka,gamenya seruu"
com.HoYoverse.Nap,Eko Bagus Septiyanto,1,2024-12-18 11:14:51,"Dari awal game nya rilis, pas gacha zonk terus, harus menghabiskan 80x gacha dulu baru dapet karakter yang S, itu juga dapet g sesuai dengan karakter yg di banner. Sudah coba tanya CS bilangnya persentase rate gacha nya random udah di atur sistem, masa iya dari awal rilis sampai sekarang rate gacha di akun saya selalu rendah, harus / wajib menghabiskan 80x gacha baru dapet karakter S. Tolong untuk tim dev untuk bisa di perbaiki permasalahan nya."
com.HoYoverse.Nap,Mi,2,2024-12-18 11:10:43,Updatean baru malah makin parah lagging gk jelas padhal spek lumayan snap gen1 8gb
com.HoYoverse.Nap,Azusa Nakano,4,2024-12-18 11:05:08,Serius gacha nya harus hard pity terus?
com.HoYoverse.Nap,Elfllyn's Shiro,1,2024-12-18 10:44:11,"Minta tolong devoper.... Kalau pemain baru..udah ngumpulin dari awal sampai 90 kali gacha,... Malah dapat rate off...tolong tiru saudara anda genshin impact ..new player should be RATE ON....not rate OFF... Ini yang bikin player zzz males.... Sistem gacha TERBURUK MIHOYO... Sudah gacha mesti dapet pull ke 90.... Dah ahh males main..."
com.HoYoverse.Nap,M. Syafiq Kurnia,5,2024-12-18 10:24:59,Menurut gue bagus gamenya untuk game hoyovers pertama yang gue mainkan.
com.HoYoverse.Nap,Vissar Design,3,2024-12-18 10:22:17,"Optimasi di HP jelek banget, sering framedrop semenjan update Outer Ring kalo gak salah. Patch awal padahal lancar loh."
com.HoYoverse.Nap,Wahyoe,1,2024-12-18 10:16:14,optimalisasi shader setelah update terlalu lama
com.HoYoverse.Nap,Astri Kusumaningtyas,1,2024-12-18 09:59:08,Kok tidak bisa diupdate ke versi terbaru padahal sudah didownload dan tertulis aplikasi tidak kompatibel. Tolong buat aplikasi kompatibel di hp saya (oppo a78)
com.HoYoverse.Nap,Raihan Christeven,5,2024-12-18 09:52:40,Damn The Character Jingle bro
com.HoYoverse.Nap,Holikh,4,2024-12-18 09:27:14,Kalo menang rate of miyabi aku kasih bintang 5
com.HoYoverse.Nap,Ali Husen,5,2024-12-18 09:25:27,Zzz void hunter
com.HoYoverse.Nap,Fahmi Nurkamil,5,2024-12-18 09:09:54,"The best game hoyo yg pernah di buat selama ini, gameplay asik, desain character cakep2, engga kikir impact!"
com.HoYoverse.Nap,Khazain 1,5,2024-12-18 09:06:09,"Sangat Fun, Setiap update selalu memberikan optimasi yang baik, sangat cocok untuk saya, Good Job Hoyo"
com.HoYoverse.Nap,Fahrul Rozi,5,2024-12-18 09:03:17,Bless me on 50:50
com.HoYoverse.Nap,Finza Onikata,5,2024-12-18 08:55:08,Optimalkan lagi Hoyo
com.HoYoverse.Nap,Tovik Hdyt,5,2024-12-18 08:50:49,Nice... game simple.. ngedaily.pun gk ribet..
com.HoYoverse.Nap,Rama Fitra,5,2024-12-18 08:41:02,"Bagus, GOK GOK GOK"
com.HoYoverse.Nap,Aditya Pratama,5,2024-12-18 08:24:26,"Aku akan terus mengikuti kalian, hoyoverse."
com.HoYoverse.Nap,Thomas Hanom Yogantoro,4,2024-12-18 08:22:44,Rate gachanya naikin dikit dong
com.HoYoverse.Nap,Rizki Dermawan Sugraeliputra,5,2024-12-18 08:21:35,Ini game bagus bngt rekomendasi(Lucy punya guejh)
com.HoYoverse.Nap,Azhar Naufal Faeyza,5,2024-12-18 07:54:46,Good
com.HoYoverse.Nap,Zikume,5,2024-12-18 07:34:22,Seru
com.HoYoverse.Nap,Arcadia,5,2024-12-18 07:22:37,Tolong diperbaiki lagi bug dan lag nya. sering seringin menang rate off plsss
com.HoYoverse.Nap,Danna Sama,5,2024-12-18 07:21:13,"suka banget ama gamenya, seruuu"
com.HoYoverse.Nap,popular activo,5,2024-12-18 07:19:41,"I played all Hoyoverse games except Tear of Themis of course and all of them are great, oh yeah I forgot to mention that my first impression when playing Honkai Impact 3rd was a bit disappointing"
com.HoYoverse.Nap,Shien Nouzen,5,2024-12-18 07:18:39,Game yang memiliki latar yang bagus di tambah dengan gameplay yang seru dan juga grafik dan animasi yang bagus memberikan kesan bermain yang sangat menakjubkan
com.HoYoverse.Nap,Feri Irawan,5,2024-12-18 07:13:45,Tolong tambah menu kaitan akun lain seperti fb dll
com.HoYoverse.Nap,Anggit setya Prayogi,5,2024-12-18 06:08:41,Akhirnya bisa maim game ini thx hoyooo
com.HoYoverse.Nap,Hani Mulyani,5,2024-12-18 06:04:12,Nice
com.HoYoverse.Nap,Jawa Aja,5,2024-12-18 05:41:36,Okelah gw dpt menang rate off 3×😁☝🏼
com.HoYoverse.Nap,Kadek Adi,5,2024-12-18 05:39:19,Gyat
com.HoYoverse.Nap,Vege Trunk,5,2024-12-18 05:39:12,Gameplay yang menarik
com.HoYoverse.Nap,Standard One,5,2024-12-18 05:31:20,"Epic battle untuk solo mode. Feeling kayak main ""Tekken""."
com.HoYoverse.Nap,ANANG PAMUNGKAS,5,2024-12-18 05:27:06,Good Game
com.HoYoverse.Nap,Andika Albari,5,2024-12-18 05:24:07,This a good game
com.HoYoverse.Nap,Muhammed Irfan (Irfan),5,2024-12-18 05:20:17,"Devnya mantap banget bener bener dengerin player nya,sekrang kalau main udh lebih lancar dibanding dulu sebelum update 1,3.mantap lah"
