app_id,userName,score,at,content
com.HoYoverse.Nap,Ahmad Sultan Aquilla,5,2024-08-21 06:26:22,Waduh
com.HoYoverse.Nap,hani fun,1,2024-08-21 00:51:17,UI hitam monoton Tolong ubah background UI di lobby menjadi warna putih #fffafafa agar tidak terlalu monoton
com.HoYoverse.Nap,iswandy usman,5,2024-08-20 23:51:41,game gacha terbaik 2024🔥🔥
com.HoYoverse.Nap,Ali? yes sir?,1,2024-08-20 23:08:59,game ngantuk
com.HoYoverse.Nap,Jovan Defana,5,2024-08-20 22:20:43,Jelek
com.HoYoverse.Nap,Aprial,5,2024-08-20 18:11:41,gamenya sangat bagus
com.HoYoverse.Nap,Myster X,5,2024-08-20 17:46:46,"Sebelumnya aku udh konfirmasi si ini untuk sebelumnya saya udh donlot 3 lebih du game ini, cmn untuk 2 dan 3 aku donlot di apk taptap dan jujur aku sungguh kecewa untuk sebelumnya Rilis di PlayStore kayak berat banget efeknya, tapi sekarang udh bisa donlot lagi di play store di awal rilis aku bisa donlot game ini namun setelah lama gk main jadi aku hapus untuk sementara, dan mau aku donlot malah tidak kompatibel wkwkw, yah sekarang udh bisa makasiii hoyovers udh bikin game bagus bagus 😊"
com.HoYoverse.Nap,Indra syabil,3,2024-08-20 17:34:40,"Game ini sudah cukup bagus menurut saya, dari segi gameplay maupun story, tapi ada satu yang menjadi masalah saya sebagai Player Android yaitu tombol yang tidak bisa disetting sesuai keinginan, karena tombol saat memulai pertarungan sangat kecil membuat saya kesulitan, mohon ditingkatkan lagi"
com.HoYoverse.Nap,Raiden,1,2024-08-20 17:33:01,"Game gak jelas!!! Baru mau login aja padahal download data belum selesai tapi malah yang muncul cuma fitur daftar server doang, gak ada lanjut download data lagi gitu. Mainnya aja belum malah gak bisa login"
com.HoYoverse.Nap,Rafael Wedi D,5,2024-08-20 16:36:00,Miyabi tolong di percepat kalau g bintang satu ni min😡
com.HoYoverse.Nap,Goresan Alif,4,2024-08-20 16:17:26,"Belum sempat main, pas liat download patch pertamanya udah 18.5GB, langsung ku-uninstal 😅"
com.HoYoverse.Nap,Vincent Nagata21,5,2024-08-20 14:49:46,Gw udh seneng banget zenless zone zero udh bisa dimainkan di mobile sekarang!
com.HoYoverse.Nap,Rifat AN,5,2024-08-20 14:45:01,"Aku punya permintaan, kasi hoki lah email nih, dari dulu main game hoyo gk pernah hoki nih email😔"
com.HoYoverse.Nap,Fachry Karlenstein,5,2024-08-20 14:24:09,Game seru
com.HoYoverse.Nap,Nasseh Rosada,5,2024-08-20 12:58:18,Akhirnya bisa download 😁😁
com.HoYoverse.Nap,blckwws,1,2024-08-20 10:10:16,Tv explore ☠️
com.HoYoverse.Nap,Uta,5,2024-08-20 09:41:42,suka game mihoyo
com.HoYoverse.Nap,Doli Saputra,1,2024-08-20 09:24:26,"Kg dapet Ellen Joe, kecewa berat"
com.HoYoverse.Nap,Rian di,3,2024-08-20 08:56:48,ini game kok nongol lagi di playstore gue?? :V padahal dulu awal rilis mau update aplikasi ada tulisan 'your device not compatible with this version' jadi gue uninstall aja :V
com.HoYoverse.Nap,Armin Arlert,5,2024-08-20 08:48:22,Tambahin Multiplayer nya dong Biar character sesama character lebih seru
com.HoYoverse.Nap,Musang Bertopi,5,2024-08-20 08:23:25,"Force close pas buka item shop dan banner event sesekali, sepertinya resource nya terlalu berat, jalan-jalan normal di kota fpsnya lancar jaya"
com.HoYoverse.Nap,Bagas Jody P,5,2024-08-20 08:13:20,Gacor kang
com.HoYoverse.Nap,Rauqan R.r,5,2024-08-20 07:23:58,Best artstyle👍
com.HoYoverse.Nap,Shiro,5,2024-08-20 07:07:30,"Gila parry nya asik banget wak, tapi tetep aja explore tv itu jujur agak ngebosenin sih min. Tapi overall gw suka banget ama ni game"
com.HoYoverse.Nap,Tayzzy,4,2024-08-20 03:14:13,Good
com.HoYoverse.Nap,Risky Tegar,5,2024-08-19 22:38:11,Good games
com.HoYoverse.Nap,Hafidz Anshari,2,2024-08-19 20:56:36,"Tolong!! Tolong sekali!! Setiap mau login ada keterangan ""Terlalu banyak permintaan"", ini sungguh mengganggu saya saat mau bermain game ini. Tolong sekali Hoyoverse untuk memperbaiki kendala ini"
com.HoYoverse.Nap,Christian Rivaldi,4,2024-08-19 20:40:45,"Secara story sebenarnya masih b aja sih, tapi untuk gameplay udah oke banget, sayang aja gak bisa loncat, semoga story kedepannya bisa lebih menarik"
com.HoYoverse.Nap,Reen Reen,1,2024-08-19 20:25:11,"LOL JUST OPTIMIZE THE GAME, SLIT-EYED"
com.HoYoverse.Nap,Eka Rachmad,3,2024-08-19 20:19:49,Bagus dan uninstall
com.HoYoverse.Nap,ahlan doank,5,2024-08-19 18:50:24,"grafik keren sekali , alur cerita cukup bagus,"
com.HoYoverse.Nap,dika,5,2024-08-19 17:57:53,"Gamenya seru, semoga tidak kikir"
com.HoYoverse.Nap,ItsJustDafa,5,2024-08-19 17:38:54,"Sejauh ini main masih GPP sih, game play nya juga seru, tapi bertarungnya terlalu pendek jadi gak bisa main lama-lama karena bosan kalo terlalu banyak obrolan daripada geludnya"
com.HoYoverse.Nap,Callysta Victoria Hwang,5,2024-08-19 16:17:10,♡♡♡
com.HoYoverse.Nap,Ngadhim Nawali,4,2024-08-19 15:52:04,"Secara keseluruhan game ini cukup bagus buat yang mau pake device mobile bisa fan juga maininnya ""hp kalian juga harus support operasi system yang di minta game-ya"" Untuk saya sendiri fun banget mainin game ini secara ya device saya mumpuni untuk memainkannya. Bisa jadi catatan buat HOYOVERSE kualitas hp yang suppor main game-nya agak diturunkan degan performa yang sama (kalo ini di dengan asli game baik kalian) 🙏🙏"
com.HoYoverse.Nap,Andika Yogi,5,2024-08-19 15:12:35,"Sebuah mahakarya yang diciptakan Hoyoverse🤩, cuma berharap ada update untuk custom hud agar kontrol main lebih nyaman"
com.HoYoverse.Nap,Gin Gin Mulyadi,5,2024-08-19 12:59:43,"kerenn!!, game play smoot lancar walau pemakaian 2jam hp mulai panas"
com.HoYoverse.Nap,Horror Lovers,1,2024-08-19 12:26:04,"Gede bngt males download datanya, kek game Harry Potter awakening ku"
com.HoYoverse.Nap,Bryan Oswald,5,2024-08-19 11:24:47,"This pretty well done, complex Combat mechanic that pretty much makes the game more smoother in terms of flow in Combat and Linda in a way better than other hoyo games for the simple facts dailies and energy are more generous in here although i still think too much common item like dennies and such could be made more common or easier to obatin but otherwise it's all pretty good because the genre split the obnoxius part of the ""community"" By offing the genre with the story long pay off and genre"
com.HoYoverse.Nap,Balangga Muhammad 8,1,2024-08-19 10:45:04,Jangan buat karakter nya telanjang buat ngak ada marwahnya karakternya 😭
com.HoYoverse.Nap,Dwi Listianto,5,2024-08-19 08:30:40,Mantap
com.HoYoverse.Nap,Fasya Basyrah,5,2024-08-19 08:16:20,"Good game lah hoyoverse buat bansosnya,sistem battlenya sama ui nya yang enak dipandang sama banyakin bansosnya 😀"
com.HoYoverse.Nap,Rafael Devananda Ampang,5,2024-08-19 08:07:19,bagus banget semangat bekerja mihoyo
com.HoYoverse.Nap,Rafisqy Devano,2,2024-08-19 07:58:46,Mobile data issue
com.HoYoverse.Nap,Muhammad Shobri Al Ghozali,5,2024-08-19 07:40:59,Gim baik
com.HoYoverse.Nap,Zaenal Arifin,3,2024-08-19 06:43:11,"Game nya tolong dibuat lebih ringan lagi, rata kiri masih lag"
com.HoYoverse.Nap,REGAL Ganzz,5,2024-08-19 06:19:10,Fitur gacha yang bagus
com.HoYoverse.Nap,Yesaya Marsel Jesen,3,2024-08-18 22:31:31,"cerita yang menarik dan gameplay yang seru, semoga kedepan nya bisa meningkat emotion karakter nya"
com.HoYoverse.Nap,Muhammad Rizka Utomo,5,2024-08-18 17:07:30,"Overall bagus banget, Grafik, Musik, Animasi, Cerita, Voice actor, dll. Saya suka banget dengan game satu ini. Mines nya hanya 1 yaitu saat mode story bangboo masuk TV itu membuat mata pusing."
com.HoYoverse.Nap,Aldy Ismail,5,2024-08-18 15:55:36,Menyala Hoyoverse 🔥
com.HoYoverse.Nap,Muhammad Aldy,5,2024-08-18 15:37:34,Game kesayangan gw nih ❤️
com.HoYoverse.Nap,Qyura,5,2024-08-18 15:24:33,Nice game
com.HoYoverse.Nap,Agustinus Pribadi,5,2024-08-18 15:09:21,Zenless zero
com.HoYoverse.Nap,Alvin Felano,1,2024-08-18 14:22:29,Gameplay nya boring explore nya dikit banget bolak balik puzzle tv
com.HoYoverse.Nap,Raffi Adhitya,5,2024-08-18 14:02:57,I like Anby and Ellen
com.HoYoverse.Nap,Darrent Heng,1,2024-08-18 13:27:54,Gimana cara bikin akun Daritadi salah password kuh
com.HoYoverse.Nap,Crash Thompson,1,2024-08-18 12:25:37,ini game atau disk rusak? MACET TERUS!!!
com.HoYoverse.Nap,Fatkhul Imron,1,2024-08-18 12:15:56,boring tv
com.HoYoverse.Nap,Megilliandi Boy Alexander,1,2024-08-18 10:19:08,"Game nya sampai 17gb size, kemudian gamenya tidak jelas dan suasana agak membosankan, bingung mau berkomentar apa lagi, setelah cape nunggu update lama, maka pilihan hanya Uninstall"
com.HoYoverse.Nap,Wanda Maurel,5,2024-08-18 09:16:03,"Meskipun udah aku hapus:( , tetap kasih bintang lima"
com.HoYoverse.Nap,Ernestine (err),5,2024-08-18 07:18:56,"Suka banget sama satu game Hoyoverse ini ,😭💐 the best, alur ceritanya bagus, voice acting nya best banget. Apalagi grafiknya ga usah di tanya deh, download ajaa 😖"
com.HoYoverse.Nap,Nizar Badut,5,2024-08-18 07:08:38,Ahir nya bisa main ini juga tadi nya gbs di download bjir 🗿 gw kasih bintang 5 nih mantep dah
com.HoYoverse.Nap,Ari Lazuardi,1,2024-08-18 07:07:22,"Sudah tidak kompatible, padahal aslinya masih bisa maen. Uninstall!"
com.HoYoverse.Nap,Koko Alvi,5,2024-08-18 07:02:10,"cs nya sigap banget, update 1.1 awalnya gak bisa, akhirnya bisa juga, apalagi jadi lebih ringan, ceritanya juga makin seru, the best lah, akun nya juga dah lembali, sip"
com.HoYoverse.Nap,P1,5,2024-08-18 06:31:44,Bgus
com.HoYoverse.Nap,Fathurrahman Zein,5,2024-08-18 06:09:30,Terimakasih game baik
com.HoYoverse.Nap,Roland Alexandro,5,2024-08-18 02:29:35,1 kata bagus
com.HoYoverse.Nap,axia,2,2024-08-18 01:47:58,I lost 50-50 always the game is mean to me
com.HoYoverse.Nap,Kiyan Ghost,1,2024-08-18 01:38:25,I HATE TV EVERYWHERE!!. HI3 & HSR Way better than this game.
com.HoYoverse.Nap,Cluster,5,2024-08-17 23:14:42,"Bagus kali update kali ini, entah kenapa sejak update kayaknya jadi berasa jauh lebih lancar gamenya di hpku yg Helio g99 Kalo sebelum ini kayak sering framedrop gitu. Walaupun kemarin waktu aku mau update kok ada tulisan gak kompetibel di play store padahal sebelum-sebelumnya kompetibel untungnya aku masih bisa update dari tabtab, Mungkin karena akunku yang pernah terhubung di hp ram 4 sih. Thanks developer, kayaknya gamenya emang lebih lancar sekarang😆"
com.HoYoverse.Nap,I Putu Riski Pradiana Bali,4,2024-08-17 22:40:23,"Kikir!!!!! Tambahkan lah karakter bohai, baru aku kasih bintang lima"
com.HoYoverse.Nap,main game,3,2024-08-17 21:47:37,"Tambahkan fitur auto battle, auto search menuju ketempat mana"
com.HoYoverse.Nap,Hyouka PRO,5,2024-08-17 20:43:23,Semoga hokyyy
com.HoYoverse.Nap,Ben Beckman,5,2024-08-17 18:59:57,PERFECT! YG KASI BINTANG 1 FIX HP NYA KENTANK.
com.HoYoverse.Nap,RNF「FN」,5,2024-08-17 18:25:04,Alhamdulillah compatible lagi😇
com.HoYoverse.Nap,Vito Dama saputra,5,2024-08-17 18:14:15,"Gamenya bagus, tapi animasi saat gacha dan saat mau membuka/meningkatkan character itu masih lag padahal udh grafik rendah dan juga perangkat udh memenuhi spesifikasi tapi animasinya saat gacha dan saat mau membuka/meningkatkan character itu lag banget. Mohon diperbaiki 🙏🙏🙏."
com.HoYoverse.Nap,Bronya Zaychik,1,2024-08-17 17:47:37,Secara tiba tiba mendapatakan pemberitahuan tidak kompatibel setelah di instal Padahal saat dimainkan game nya berjalan lancar dan stabil Mohon diperbaiki soal kompatibel ini
com.HoYoverse.Nap,TaqiyKun,5,2024-08-17 17:25:44,nice
com.HoYoverse.Nap,Sugi Arto,5,2024-08-17 17:17:31,Indoesia
com.HoYoverse.Nap,Muhammad Rafli Rosyid Abdullah,4,2024-08-17 16:49:48,Akhirnya bisa download
com.HoYoverse.Nap,Haeqal R.A,5,2024-08-17 15:22:53,Lumayan
com.HoYoverse.Nap,Bapak Kaeya,2,2024-08-17 14:00:25,Mode TV nya mengganggu pengalaman bermain. Memang di akhir² atau lvl tinggi lebih banyak aksi. Namu cukup menggangu player baru yg sudah saya ajak bermain. Alhasil banyak player baru yg tidak melanjutkan bermain.
com.HoYoverse.Nap,Wanwan,1,2024-08-17 13:27:18,Map kecil cuma banyak main di tv
com.HoYoverse.Nap,Muhammad Khoirul Zaky,5,2024-08-17 13:07:45,Let's gooooooooooo bisa main ni game lagi coyyyy
com.HoYoverse.Nap,Agung Dwi Mulyadi,5,2024-08-17 11:50:22,Gamenya keren tapi ada beberapa kurang cuma masalah di touchscreen secara gak sengaja atau apa pas mau chain dmg ke bangboo malah ke agen karakter hanya itu saja saya sampaikan gua kasi rating 5 biar tidak kejadian hal yang sama terima kasih hoyoverse
com.HoYoverse.Nap,FireFly Lover,5,2024-08-17 11:43:03,Game baik terimakasih emuach emuach
com.HoYoverse.Nap,No NAME,3,2024-08-17 11:18:16,Dikit2 loading scene males bet nunggu loading scene yg lama
com.HoYoverse.Nap,Kiyopon Ayanokoji,3,2024-08-17 11:17:28,gw kira MC bisa di mainin ternyata enggak
com.HoYoverse.Nap,Aris Mamengko,5,2024-08-17 10:31:15,"Game terbaik 2024, keep it up Hoyoo... ❤❤"
com.HoYoverse.Nap,Diki Rohmatulloh,5,2024-08-17 10:08:36,Suka karena boing boing
com.HoYoverse.Nap,Nazriel Ervin R,5,2024-08-17 09:33:10,akhirnya balik di playstore 😭😭😭
com.HoYoverse.Nap,dzaki wwiryawan,5,2024-08-17 09:22:02,butuh lebih bnyk bansos
com.HoYoverse.Nap,Luki 1130,5,2024-08-17 08:37:13,"Untuk optimalisasi ditingkatkan lagi ya dev, overal semua udah bagus"
com.HoYoverse.Nap,Yang Mulia,1,2024-08-17 07:20:44,lah tumben bisa ke install dlu gk bisa malah kompatibel.. aneh nih (︶｡︶)zzZ
com.HoYoverse.Nap,Rinn,1,2024-08-17 06:49:01,"Tolong developer, ini kenapa tidak bisa download data didalam gamenya? Penyimpanan Hp saya masih banyak, kenapa selalu muncul tulisan ""ruang penyimpanan disk tidak cukup, harap kosongkan"". Ruang penyimpanan saya masih luas, download data gamenya 18gb. Seharusnya cukup.. tolong diperbaiki lagi"
com.HoYoverse.Nap,Cyber Destro,5,2024-08-17 06:29:26,Bangboo anak baikkk
com.HoYoverse.Nap,Yusuf Anwar,5,2024-08-17 06:25:17,"Anjay, tidak bisa download data :v"
com.HoYoverse.Nap,Neni Rahmat Mulyani,1,2024-08-17 05:52:13,Game aneh Loading Nya lama bangett Gilaaa Mana Delay Lagi gerak nya Gajelas Gajelass Size gede Tapi Gak sesuai!!!
com.HoYoverse.Nap,Gill,5,2024-08-17 00:12:42,"Gila permintaan gua soal permasalahan kompatibel diperbaiki sama mihoyo, sesuai janji gua bakal tambahin bintang nya dari dua jadi 5 untuk kepedulian ke player nya 😁 gua bukan bot atau di bayar sama hoyo ye btw. Sekali lagi makasih loh 🥰"
com.HoYoverse.Nap,Fabio Moreno,5,2024-08-17 00:11:42,"Nice banget pindah dari laptop ke mobile dan ya sangat mantap (device vivo x100 pro), bisa di pakein gamepad pula di hp, tambah mirip kek di laptop namun di layar yang lebih kecil. Sangat mantap tolong tambahkan lagi fitur fitur yang bermanfaat☺☺☺"
com.HoYoverse.Nap,Yawan Gamers,5,2024-08-16 23:56:20,Game terbaik. Game satu-satunya yang bisa menghabiskan waktu sepanjang dalam hidup saya. Terima kasih atas supportnya kepada pihak developer karena gamenya sudah support lagi di device saya.
com.HoYoverse.Nap,Haldi Satriawan,5,2024-08-16 23:51:11,"Wahh makasih hoyo, udah di muncul lagi di play store"
com.HoYoverse.Nap,Handi Nugroho,5,2024-08-16 23:49:30,Seruuuuuuu
com.HoYoverse.Nap,Bo Geng,5,2024-08-16 23:32:43,Mantap
com.HoYoverse.Nap,Apri 3199,5,2024-08-16 23:26:29,mantap
com.HoYoverse.Nap,RE:projekt,4,2024-08-16 22:59:20,"Overall semuanya udah bagus, dari grafik & story nya aku suka. Cuman di gacha aja yg masih pelit. So far aku cuman dpt 2 karakter S. Semoga ke depannya gak pelit lah."
com.HoYoverse.Nap,Kyura 2701v,5,2024-08-16 22:55:20,game baik/ mungkin yg nggak disukai dimode tvnya
com.HoYoverse.Nap,テンペストリムル,5,2024-08-16 21:35:21,More Reward!!
com.HoYoverse.Nap,ROFIQRISMA AINURKHARIEZMA,1,2024-08-16 20:05:37,Game alur cerita gak jelas. Dan terlalu banyak item dan gak jelas juga mau apa.
com.HoYoverse.Nap,Fahri Ramadhan,5,2024-08-16 19:57:04,Game bagus😹😹
com.HoYoverse.Nap,Astro Rei,5,2024-08-16 19:32:04,Makasih Dev
com.HoYoverse.Nap,Chaerul Anwar,5,2024-08-16 19:29:31,"Bagus game nya, meski gw maen di pc karna hp gak kuat tapi tetep gw kasih rate playstore"
com.HoYoverse.Nap,deny romanda,5,2024-08-16 19:27:25,Buat hellio G99 bisa maen dong
com.HoYoverse.Nap,meiko sora,5,2024-08-16 18:02:32,👍👍👍
com.HoYoverse.Nap,Ghalang,3,2024-08-16 17:29:06,Padahal kemaren kompatibel tiba tiba tidak kompatibel
com.HoYoverse.Nap,Azelle Cainz,4,2024-08-16 17:06:01,Bagus sih tapi semoga game ini masih kurang optimalisasi dan beberapa fitur
com.HoYoverse.Nap,Glory Pua,5,2024-08-16 15:57:16,Jane Doe😍😍😍
com.HoYoverse.Nap,Yuda Permana (Yuda),5,2024-08-16 15:56:24,"let's go 🔥🔥🔥🔥, akhirnya suport"
com.HoYoverse.Nap,ZIDAN YUDISTIRA,5,2024-08-16 15:45:06,"Setelah update 1.1 akhirnya sistem rekomendasi spek nya di perbaiki dan saya bisa download lagi di play store, makasih hoyo..."
com.HoYoverse.Nap,Muhammad imam Ghazali,5,2024-08-16 12:59:39,"Game keren, ga kek kakaknya"
com.HoYoverse.Nap,Apple Pie,5,2024-08-16 12:43:31,"Sebelumnya banyak masalah di optimalisasi, tapi sekarang setelah update 1.1 terasa lebih lancar dan menjadi lebih baik dari sebelumnya. Saya harap game ini bisa terus berkembang ke arah yang lebih baik."
com.HoYoverse.Nap,Habiib Al aziz,5,2024-08-16 12:33:55,"Alhamdulillah akhirnya berwarna, dan bisa bermain dengan tenang di HP :)"
com.HoYoverse.Nap,Blitz PTX,1,2024-08-16 12:32:32,HPKU RA KUAT ANJAY
com.HoYoverse.Nap,audy vinsky firnadi,5,2024-08-16 11:40:39,Okeh udah normal udah muncul lagi di google playstore Chipset mediatek Helio G99
com.HoYoverse.Nap,Mugni Abdilah,5,2024-08-16 11:34:54,tingkatkan kualitas
com.HoYoverse.Nap,Zhafran Aziz,5,2024-08-16 11:34:46,"Game nya bagus, penuh warna dan yg paling terbaik ada fitur skip cerita"
com.HoYoverse.Nap,San Humas43,1,2024-08-16 11:24:50,yg rate apa yg dapat apa... ngg jelas sampai 90 pulah gachanya malah yg rate up ngg dapat .. calon deat game mending main solo leveling free to play masih bisa ngimbangin setiap hari di kasih suplay ..
com.HoYoverse.Nap,Herman Wang,5,2024-08-16 11:22:38,"terima kasih atas masalah kontipabel nya, akhirnya bisa download jg nih game.sebelum nya GK bisa download gara2 kontipabel"
com.HoYoverse.Nap,Reen Yaeger,1,2024-08-16 11:20:43,Ntah lah
com.HoYoverse.Nap,AxBlack,1,2024-08-16 10:43:38,"PENTING: Tdk ada fitur co-op melawan weekend boss, loading game saat mengganti map/berpindah area terlalu lama malah menggagu, sebagian di dialog mode explorasi tdk bisa diskip, terutama yg bagi maptv, bagian map explorasi agak DISTURBING (menurut saya) kurang nyaman dimainkan lama2"
com.HoYoverse.Nap,Dizura Tomo,5,2024-08-16 10:13:04,Bagus
com.HoYoverse.Nap,Nafi'ul Anam,5,2024-08-16 10:10:53,Mantap
com.HoYoverse.Nap,carla swan,5,2024-08-16 10:05:27,panjang umur game baik.....😌😌
com.HoYoverse.Nap,SEFZA,5,2024-08-16 09:30:14,Akhirnya bisa juga menginstal game ini di playstore
com.HoYoverse.Nap,Aidil Syahrizki,5,2024-08-16 09:25:11,"Selebihnya bagus,tapi suara game nya kecil banget buset,nggak kedengaran tolong perbaiki untuk suara game nya."
com.HoYoverse.Nap,Idlan Rahman Nurhakim,5,2024-08-16 09:06:17,Ellen wanita🥰
com.HoYoverse.Nap,WAHYU PRATAMA ADINEGORO,1,2024-08-16 08:43:57,"Tambahkan map yang lebih variatif tidak itu itu saja, saran saya buat perbedaan map pada setiap misi story seperti sesudah menyelesaikan suatu misi maka pada misi lain konsep area map akan berubah seperti pada honkai impact 3 jadi tidak membuat player menjadi jenuh"
com.HoYoverse.Nap,Ma'ruf Waliyudin,5,2024-08-16 08:36:20,Finally bisa download lewat PlayStore
com.HoYoverse.Nap,sinar siagian,5,2024-08-16 08:30:07,Game yang bagus
com.HoYoverse.Nap,Muhammad nabil,5,2024-08-16 08:06:26,Game nya bagus mungkin ditambahin karakter swisuitnya karakter
com.HoYoverse.Nap,Didin Jamaludin,5,2024-08-16 08:06:08,"Best RGP Hack & Slash, Konsep dunianya unik dan gameplay juga agak beda dengan game hack n slash lainnya"
com.HoYoverse.Nap,Satria Haikal,5,2024-08-16 07:27:31,Good
com.HoYoverse.Nap,maikel wahid,5,2024-08-16 06:50:57,"Akhirnya dah kebuka untuk techno :"" kupikir GK bisa"
com.HoYoverse.Nap,DreedBy,5,2024-08-15 23:53:23,"Optimasi nya lancar parah di banding versi sebelumnya, The best lah 👍 (g99 cik)"
com.HoYoverse.Nap,refza daffa,5,2024-08-15 22:49:42,"optimalisasi sudah membaik, kerja bagus"
com.HoYoverse.Nap,Heri Hermawan,3,2024-08-15 22:49:21,Ini serius download datanya 18GB
com.HoYoverse.Nap,Aryadafa Pratama,5,2024-08-15 21:59:52,Good project👍👍👍
com.HoYoverse.Nap,Viju Dwi Aldiansah,5,2024-08-15 21:49:07,Makasih untuk kompatibilitas device nya
com.HoYoverse.Nap,Pradnya Wehastama,5,2024-08-15 21:03:42,Plis developer bisa di gunakan di perangkat saya karena saya benar² suka kali game ini
com.HoYoverse.Nap,Keke,5,2024-08-15 20:49:55,Akhirnya ada game yang bisa buat gua hype lagi. Keren nih game
com.HoYoverse.Nap,Muhammad Azis Ramadhan,5,2024-08-15 20:40:57,Gamenya bagus dan saya sangat suka dengan game ini... Terimakasih juga telah mengembalikan kompatibel pada beberapa perangkat hp... Terimakasih mihoyo.
com.HoYoverse.Nap,syahid fadani,5,2024-08-15 20:31:25,"bagus , itu yg B1 hp nya kentang 😂"
com.HoYoverse.Nap,GNT 17,5,2024-08-15 19:38:00,"Bosen main genshin, and then zzz rilis jadi lebih fresh dengan gameplay yang beda"
com.HoYoverse.Nap,Randy Ahmad Fauzi,5,2024-08-15 18:58:15,Zenless Zone Zero Bagus Sekali & Seru Sekali👍👍👍
com.HoYoverse.Nap,Apat. AF,5,2024-08-15 18:57:17,Game play nya sangat mantap
com.HoYoverse.Nap,Rachman Buana,4,2024-08-15 18:51:57,Perbaikan masalah fast respon Trims
com.HoYoverse.Nap,Moch Ramlan Maulana,5,2024-08-15 18:46:53,Game baik
com.HoYoverse.Nap,Leozo kunz,5,2024-08-15 18:42:23,mantap
com.HoYoverse.Nap,ARA GAMING 02007,5,2024-08-15 18:31:24,semoga game nya menjadi lebih berkembang dan menyenangkan
com.HoYoverse.Nap,Moh Wahyu,5,2024-08-15 18:28:20,I love Ellen Joe
com.HoYoverse.Nap,Aldo Studio,3,2024-08-15 18:25:44,Gila!!! untuk Side Quest aja udah sesusah itu ya? siapapun yang punya ide bikin Side Quest sesusah itu........ selamat!!! semoga ada player / orang yang belum main ZZZ bisa jadi tertarik untuk memainkan ZZZ!!!
com.HoYoverse.Nap,Ventus,1,2024-08-15 18:14:25,"Hilangkan mode TV puzzle nya kenapa enga di bikin langsung combat aja tanpa ada TV puzzle, Karena itu sangat membosankan. Sangat Anoying"
com.HoYoverse.Nap,Cameleon Hero,5,2024-08-15 18:10:58,"Gak kalah sama game fighting lainnya seperti punishing gray raven, whutering waves,dll."
com.HoYoverse.Nap,Dimas Prasetyo (Dimas),4,2024-08-15 18:08:25,"Tolong perbaiki dibagian grafik nya, resolusinya terlalu rendah, padahal disetting udah tinggi Saya yakin Device saya sanggup untuk menjalankan nya, mengingat saya juga memainkan HI3 dengan settingan medium-high dengan baik."
com.HoYoverse.Nap,HΔN,5,2024-08-15 17:49:06,"Bagus banget dehh,yang bilang game nya jelek sering keluar sendiri dan lain lain,tu hp kalian aja yang GK sanggup"
com.HoYoverse.Nap,Destiny Child,5,2024-08-15 17:25:11,Mantap udah kompatibel sekarang
com.HoYoverse.Nap,Alif J.A,5,2024-08-15 17:18:10,"Good game, i like it"
com.HoYoverse.Nap,Muhammad Arman,5,2024-08-15 17:15:16,Game AAA mobile terbaik🔥
com.HoYoverse.Nap,sule pliken,5,2024-08-15 16:28:13,G99 kompatibel cuy
com.HoYoverse.Nap,Sultan Fauzan Azima,1,2024-08-15 16:03:25,Sadly
com.HoYoverse.Nap,Mirza Yoewono,5,2024-08-15 15:19:01,Gamenya oke banget
com.HoYoverse.Nap,Vilania,1,2024-08-15 14:20:20,"Story mudah bosan,kurang optimal,dan bug lobby hitam"
com.HoYoverse.Nap,Numan,5,2024-08-15 14:15:48,"Kompatibel lagi, yesss"
com.HoYoverse.Nap,Gede Sastra,5,2024-08-15 13:52:38,Udah bisa main di chipset heliogate 99
com.HoYoverse.Nap,Adryan Ramadhan Lukum,5,2024-08-15 13:34:54,"Good UI design, Combat Mechanic and music."
com.HoYoverse.Nap,ALGHAZALIRUMI GHALI,5,2024-08-15 12:59:50,Akhirnya HP saya sanggup memainkan game ini
com.HoYoverse.Nap,SyhMe,5,2024-08-15 12:29:48,Luar biasa :)
com.HoYoverse.Nap,Eric Eka Putra,5,2024-08-15 12:19:36,Thanks gamenya sudah di support compatible di heliog96
com.HoYoverse.Nap,RAFFA AGUNG HERYANSYAH,1,2024-08-15 11:19:26,Ngeleg jir kek wuwa
com.HoYoverse.Nap,Ardi Pratama,1,2024-08-15 11:00:20,Kikir buriq
com.HoYoverse.Nap,Aloysio Adi Nugroho,5,2024-08-15 10:51:08,burger bangor
com.HoYoverse.Nap,SLL_ XVII,1,2024-08-15 10:25:52,ketika mau di update perangkat di bilang tidak kompetibel
com.HoYoverse.Nap,Rioahmad Aditya,3,2024-08-15 10:15:50,setidaknya 20 kali spin dapat Tier s
com.HoYoverse.Nap,Angga Edo,3,2024-08-15 10:09:20,"Ribet, pelit"
com.HoYoverse.Nap,Vinoagung Sku18,4,2024-08-15 10:07:58,"Ok menurut ku yh semuanya udah ok apalagi dalam segi gamplay tapi untuk mata uang buat gachanya itu agak bikin pusing kenapa gak dibikin simple aja jadinya ak sampe sekarang ngak top up karna ya itu pusing bet plis di bikin lebih simple sama terlalu banyak loading dikit"" loading dikit"" loading itu yang bikin agak boring sama ngantuk plis w ga masalah mbnya agak gede dikit yang penting loading nya dikurangi udah itu aja overal good game"
com.HoYoverse.Nap,irvan maulana,3,2024-08-15 10:05:53,Berat kali
com.HoYoverse.Nap,Capt,5,2024-08-15 02:08:57,👍👍👍👍
com.HoYoverse.Nap,Megumi J,5,2024-08-15 00:11:41,Lebih di optimalisasi lagi
com.HoYoverse.Nap,Omiam,5,2024-08-14 23:52:07,"Saya Sangat Berterima Kasih Kepada Developer (COGNOSPHERE PTE. LTD.) Karena Sudah Memperbaiki Masalah Kompatibel Yang Saya Alami, Sukses Selalu Dalam Membuat Membuat Game Yang Menarik Di Mata Para Gamer Di Luar Sana!"
com.HoYoverse.Nap,Ardiansyah Ferry A.,5,2024-08-14 22:38:40,Akhirnya berwarna juga enggak hitam lagi latarnya
com.HoYoverse.Nap,Abdul Majid,5,2024-08-14 20:35:17,Mantap
com.HoYoverse.Nap,Fauzi Alvansyah,5,2024-08-14 19:32:04,"Semakin bagus dan berkembang story dan lain nya, menunggu miyabi datang.."
com.HoYoverse.Nap,Akagami Ryu,5,2024-08-14 19:03:27,best game for casual Player
com.HoYoverse.Nap,Ghieza ap,5,2024-08-14 18:27:47,the parry was so satisfying
com.HoYoverse.Nap,decxkz oly,3,2024-08-14 18:24:00,Setelah update frame drop parah sudah dituruni ke grafik sedah juga masih sama
